_id,url,word_count,section,date,type,headline,abstract
nyt://article/6d163f1b-d963-5abe-88c6-724c55f14ce1,https://www.nytimes.com/2009/03/16/business/worldbusiness/16haven.html,630,Business Day,2009-03-16T00:12:27+0000,Business,"As Tax Havens Acquiesce, Monaco Adopts Standards",Monaco is the latest country to adopt international standards for banking openness and information-sharing.
nyt://article/800bbb42-5d5d-59df-abc0-17f88b5dc72a,https://www.nytimes.com/2009/02/24/business/24citigroup.html,812,Business Day,2009-02-24T02:41:43+0000,Business,3rd Rescue Would Give U.S. 40% of Citigroup,"Nationalization, perhaps a partial one, appears to be inevitable for the financial giant."
nyt://article/b77e2e6d-878f-5e29-a68b-64f559ae690d,https://www.nytimes.com/2009/02/04/world/asia/04nkorea.html,402,World,2009-02-03T07:37:49+0000,Foreign,North Korean Activity Stirs Fears of a Missile Test,North Korea has been moving what appear to be components of a long-range missile to a newly constructed launch site.
nyt://article/79031437-b3f0-5bfa-85be-e28d4898a4e9,https://www.nytimes.com/2009/01/12/business/media/12adnewsletter1.html,948,Business Day,2009-01-12T17:47:58+0000,Business,Do Online Universities Have Virtual Cheerleaders?,"Kaplan University, which bills itself as “a different school of thought,” is suggesting in ads that online learning is a way to develop talent that could otherwise go to waste."
nyt://article/f22bf2d8-8099-5fe4-a553-4ea863a1c248,https://www.nytimes.com/2009/01/20/world/asia/20tibet.html,422,World,2009-01-19T14:20:54+0000,Foreign,China Aims at Dalai Lama With New Tibet Holiday,Legislators in Tibet passed a bill on Monday mandating an annual celebration of the date that the Communists declared rule over Tibet.
nyt://article/04bd8c76-bcb2-5a2a-9657-efba18c57a49,https://www.nytimes.com/2009/03/26/business/26madoff.html,873,Business Day,2009-03-25T20:19:40+0000,Business,Assets Frozen for Brother of Madoff,The trustee already handling the liquidation of Bernard L. Madoff’s New York brokerage business has been given control of his stake in his London operation.
nyt://article/cf35a63b-c99d-51da-a291-6511df5580a2,https://www.nytimes.com/2009/02/13/technology/internet/13privacy.html,538,Technology,2009-02-13T01:56:56+0000,Business,Agency Skeptical of Internet Privacy Policies,The Federal Trade Commission said Internet companies are not explaining to users what information they collect about them.
nyt://article/53e702a7-3c3a-5e0d-b7de-5a7a5424054d,https://rendezvous.blogs.nytimes.com/2009/03/27/global-sports-forum-formula-one-edition/,1857,World,2009-03-27T06:50:40+0000,,Global Sports Forum: Formula One Edition,PART THREE: THE TEAMS
nyt://article/657f3899-7e6d-57f0-9bae-d062004d7edc,https://gadgetwise.blogs.nytimes.com/2009/01/27/panasonic-goes-wide-with-25mm-lenses/,540,Technology,2009-01-27T16:07:35+0000,,Panasonic Goes Wide With 25mm Lenses,Panasonic’s new digital cameras offer ultra-wide-angle lenses.
nyt://article/40dac995-b2cb-524a-adfd-94b68de7c7df,https://dealbook.nytimes.com/2009/01/21/jhl-capital-reports-gains-of-up-to-18/,307,Business Day,2009-01-21T22:29:57+0000,Business,JHL Capital Reports Gains of Up to 18%,"John Paulson isn’t the only hedge fund manager to come out of 2008 with big profits. The Chicago-based JHL Capital Group, a small firm run by James H. Litinsky, chalked up gains of 17.1 percent to 18 percent net of fees last year despite the global stock market meltdown, according to a letter the firm sent to clients on Tuesday. "
nyt://article/22ba4f6f-4dcf-5b1e-ba4d-690e020183e1,https://dealbook.nytimes.com/2009/01/15/another-view-advice-on-lawyers-for-madoff-investors/,2485,Business Day,2009-01-15T22:29:22+0000,Business,Another View: Advice on Lawyers for Madoff Victims,"Eric M. Rosenberg, an attorney and president of LitigationProofing, a firm that helps companies limit exposure to potential lawsuits, offers this view of what Bernard L. Madoff’s investors should consider when they are choosing lawyers to seek recovery of their money:"
nyt://article/36b3daa3-4b97-5d81-9b8c-b05b61cc2351,https://gadgetwise.blogs.nytimes.com/2009/01/13/new-sdxc-memory-cards-to-hit-2-terabytes/,336,Technology,2009-01-13T19:57:27+0000,,New SDXC Memory Cards to Hit 2 Terabytes,New XDSC memory cards will offer 2 terabytes of storage.
nyt://article/222eb9d9-bfef-5cd6-8f58-eac5b17aed1a,https://dealbook.nytimes.com/2009/03/17/adding-up-aigs-backdoor-bailouts/,491,Business Day,2009-03-17T18:30:43+0000,Business,Adding Up A.I.G.’s Backdoor Bailouts,"Of the $170 billion in government funds used to prop up American International Group, a large chunk has gone to buy soured securities — at full price — from big banks like Goldman Sachs."
nyt://article/6a8384f7-446e-5e88-9811-fcfe53cc10da,https://dealbook.nytimes.com/2009/01/09/after-madoff-regulatory-oversight-of-auditors-is-back/,347,Business Day,2009-01-09T12:02:56+0000,Business,"After Madoff, Regulatory Oversight of Auditors Is Back","The Securities and Exchange Commission has quietly backed away from a rule that had allowed the accounting firm that audited Bernard L. Madoff Investment Securities to avoid oversight by a regulator that was created after the Enron and WorldCom scandals, The New York Times’s Floyd Norris reported."
nyt://article/dbe6cadf-927a-5b6a-a6dc-5b7ac6d86ec8,https://dealbook.nytimes.com/2009/02/13/large-banks-on-the-edge-of-insolvency/,1235,Business Day,2009-02-13T11:30:44+0000,Business,Solvency of Big Banks Is Questioned,"Some of the nation’s large banks, according to economists and other finance experts, are like dead men walking, The New York Times’s Steve Lohr reports."
nyt://article/bf0e06b5-b3a8-59f0-8011-b11a24cb3ea5,https://dealbook.nytimes.com/2009/03/24/dr-doom-finds-promise-in-obamas-toxic-asset-plan/,565,Business Day,2009-03-24T22:23:56+0000,Business,Dr.  Doom Finds Promise in Obama’s Toxic-Asset Plan,"Nouriel Roubini, a/k/a “Dr. Doom,” is giving the Obama administration’s new plan to buy toxic assets the thumbs up. "
nyt://article/3d8e1a27-67d5-549b-9ec6-b4b5ee58ecef,https://gadgetwise.blogs.nytimes.com/2009/01/16/from-dealbook-circuit-city-to-liquidate/,151,Technology,2009-01-16T16:42:24+0000,,From DealBook: Circuit City to Liquidate,"The nation’s number-two tech retailer is seeking court approval to shut down, says our blog-cousin DealBook."
nyt://article/a755b2e7-f710-5c62-a0b1-536b695f951d,https://www.nytimes.com/2009/01/22/business/22citi.html,1209,Business Day,2009-01-22T00:53:01+0000,Business,Parsons Is Named Chairman of Citigroup,The appointment will put to use Richard D. Parsons’s ties to the Obama administration as well as his experience in running companies under a federal microscope.
nyt://article/98595e99-0a76-5c7e-9cbe-e93184de3d12,https://www.nytimes.com/2009/02/05/world/europe/05london.html,602,World,2009-02-05T01:18:38+0000,Foreign,"Citing U.S., British Court Blocks Data on Suspect",The court said the U.S. threatened to stop sharing intelligence with Britain if it released information on a man who says he was tortured in American custody.
nyt://article/88488163-6525-5abb-8f65-e25df337dfe4,https://www.nytimes.com/2009/01/15/technology/personaltech/15pogue-email.html,1160,Technology,2009-01-15T18:24:37+0000,Business,Twittering Tips for Beginners,I’m still dubious about Twitter’s prospects for becoming a tool for ordinary people. But one thing’s for sure: The whole thing would be a lot more palatable if somebody would explain the basics.
nyt://article/d4466344-f289-57fe-9625-7bc7b384192f,https://www.nytimes.com/2009/03/03/business/media/03adco.html,1110,Business Day,2009-03-03T00:34:53+0000,Business,"The Vocabulary of Snacking, Lightly Sweetened","The confectionery behemoth Mars is introducing a campaign for its best-selling brand, Snickers, that is centered on a make-believe language called Snacklish."
nyt://article/9684af88-64a5-5b08-b4ed-ed15921b31b1,https://www.nytimes.com/2009/01/20/world/middleeast/20arabs.html,901,World,2009-01-20T03:01:05+0000,Foreign,Israeli Arabs Recoil at Attacks on Gaza as Allegiance to Their Country Is Strained,"Israel’s Arab citizens, who make up a fifth of the population, are in anguish about the recent attack on Gaza — and furious at the state."
nyt://article/909f8d7b-5e27-5cc0-bb75-2282589e23d7,https://www.nytimes.com/2009/03/17/world/asia/17judge.html,1075,World,2009-03-17T04:19:23+0000,Foreign,"Reinstatement of Pakistan’s Chief Justice Ends a Crisis, but It Might Lead to Another","Restored by a popular outpouring, Chief Justice Iftikhar Muhammad Chaudhry could have more potential to further jolt Pakistan’s politics, some of his supporters say."
nyt://article/83c7694a-e6bb-5073-b03b-6a6ddc1d2603,https://www.nytimes.com/2009/03/07/your-money/taxes/07wealth.html,1204,Your Money,2009-03-06T22:07:59+0000,Business,Some Consolation for Those in the Top Tax Bracket,A few shrewd decisions now can lower tax bills under the 39 percent rate President Obama proposes.
nyt://article/f9d479ab-4dea-5f0a-8ab5-1531d189ab05,https://www.nytimes.com/2009/02/22/world/asia/22afghan.html,447,World,2009-02-21T20:44:01+0000,Foreign,U.S. Concedes Afghan Attack Mainly Killed Civilians,"An airstrike by the United States-led military coalition killed 13 civilians and 3 militants on Tuesday, military officials said."
nyt://article/14afa63f-0237-5451-bfb8-be5249db7b8d,https://www.nytimes.com/2009/01/06/world/europe/06church.html,1097,World,2009-01-06T03:43:26+0000,Foreign,Spain Is a Battleground for Church’s Future,"When a judge recently ruled that a public school must remove the crucifixes from classroom walls, it was the latest blow to the Catholic Church’s once mighty grip on Spain."
nyt://article/a25f5ce3-073e-5efd-943b-d56dd95fb67a,https://www.nytimes.com/2009/02/09/business/media/09addes.html,620,Business Day,2009-02-09T03:24:26+0000,Business,"Accounts, People, Miscellany",Accounts
nyt://article/ae82227a-cc75-53c0-9d5c-a892d075e324,https://www.nytimes.com/2009/02/01/business/01unbox.html,983,Business Day,2009-01-31T18:57:40+0000,SundayBusiness,"Disruptive Innovation, Applied to Health Care","Technological advances are making it possible to envision a health care system that provides more individualized care without necessarily increasing costs, some experts say."
nyt://article/b216e3cc-36e6-5354-8051-97c83166faec,https://www.nytimes.com/2009/01/04/world/04lundquist.html,723,World,2009-01-04T03:57:56+0000,Culture,"Oliver Lincoln Lundquist, Designer, Is Dead at 92","Mr. Lundquist, an architect and industrial designer, led the team that created the United Nations logo."
nyt://article/a1ea3fad-7e1b-57df-9c39-68fc82de1b1f,https://www.nytimes.com/2009/01/09/business/09merrill.html,329,Business Day,2009-01-09T02:51:53+0000,Business,Another Merrill Executive Departs in Wake of Merger,"Merrill Lynch lost another senior executive as the firm’s investment banking chief, Gregory J. Fleming, announced that he would leave for a teaching post at Yale."
nyt://article/54330306-848e-5075-a21f-f142773e3f0c,https://www.nytimes.com/2009/03/26/world/americas/26mexico.html,835,World,2009-03-25T14:49:39+0000,Foreign,Clinton Says U.S. Feeds Mexico Drug Trade,Secretary of State Hillary Rodham Clinton made blunt remarks on the American role in Mexico’s drug trade.
nyt://article/415c4160-1dea-5da5-a91a-10f44cd9e9a1,https://www.nytimes.com/2009/03/29/business/29backpage-HARLEYSDEMOG_LETTERS.html,139,Business Day,2009-03-28T19:48:16+0000,SundayBusiness,Letters: Harley’s Demographics,To the Editor:.
nyt://article/92ccc089-9e9f-51a8-b1a9-a2c734e54f03,https://www.nytimes.com/2009/02/20/world/middleeast/20iraq.html,949,World,2009-02-19T19:26:59+0000,Foreign,"At Trial, Iraqi Calls Shoe-Throwing Payback",The first day of the trial for Iraqi journalist Muntader al-Zaidi offered few surprises but no shortage of commotion.
nyt://article/6cbba4d5-c030-5d6e-9a30-437d7738c8e0,https://www.nytimes.com/2009/03/24/world/asia/24japan.html,306,World,2009-03-23T07:37:31+0000,Foreign,Pilots Killed in Crash of FedEx Plane in Japan,"A Federal Express cargo plane burst into flames as it landed outside of Tokyo, and the police confirmed that the pilot and co-pilot had been killed."
nyt://article/20827e3d-fd05-522a-910f-7418ec4a0fa2,https://www.nytimes.com/2009/03/15/business/media/15shelf.html,822,Business Day,2009-03-14T19:47:25+0000,SundayBusiness,"India’s Potential, Seen From the Inside","In “Imagining India,” Nandan Nilekani, a founder of Infosys Technologies, offers guiding ideas on the transformation of India."
nyt://article/69bf0209-ca57-57a8-91cc-3da713e1dcd1,https://www.nytimes.com/2009/02/25/world/africa/25briefs-TSVANGIRAIAL_BRF.html,106,World,2009-02-25T02:56:23+0000,Foreign,Zimbabwe: Tsvangirai Ally May Get Bail,"A judge ordered Tuesday that Roy Bennett, the third highest official in the opposition Movement for Democratic Change and its nominee for deputy agriculture minister, be released on bail."
nyt://article/b8ee5401-bf51-534a-bb8e-8c659d319afd,https://www.nytimes.com/2009/03/18/world/middleeast/18iran.html,582,World,2009-03-17T06:35:12+0000,Foreign,Reform Candidate Withdraws in Iran,"Mohammad Khatami, Iran’s reformist former president, has decided to withdraw from the June presidential race to support a political ally."
nyt://article/6aae7e9d-c1c2-54e5-a164-7440b8033e2b,https://www.nytimes.com/2009/01/04/world/middleeast/04iraq.html,256,World,2009-01-03T23:17:52+0000,Foreign,American Troops Wound Woman in Baghdad,"A woman was shot and badly wounded in Baghdad by American soldiers last week when she failed to respond to repeated warnings, according to a military statement."
nyt://article/3901142b-be71-5070-833e-969e4de8161b,https://www.nytimes.com/2009/03/19/business/worldbusiness/19coke.html,527,Business Day,2009-03-18T07:51:45+0000,Business,China Blocks Coke Bid for Juice Maker,"At $2.4 billion, Coca-Cola’s bid for the China Huiyuan Juice Company would been the largest takeover by a foreign company of a mainland Chinese firm."
nyt://article/77a1e203-bdec-53dd-b51a-1335eb9be7a9,https://www.nytimes.com/2009/03/18/business/media/18adco.html,1093,Business Day,2009-03-18T01:41:00+0000,Business,"Carl’s Jr. Tries to Go After the Young, and Hungry, Skateboarding Fan","Fast-food chains are trying new ways to go after young men, who seems to have turned away from television and radio to nontraditional media."
nyt://article/d8c0e500-9718-5cf4-b64f-b91e450fe31a,https://www.nytimes.com/2009/03/27/business/media/27times.html,785,Business Day,2009-03-26T16:29:57+0000,Business,Times Co. Announces Temporary Salary Cuts,"The New York Times Company said it planned a temporary pay cut of 5 percent for most employees this year, and will lay off 100 people."
nyt://article/8222544b-be1b-5f11-8790-36ed788c4ca0,https://www.nytimes.com/2009/03/07/business/economy/07home.html,1164,Business Day,2009-03-07T02:17:50+0000,Business,A Gloomy Outlook for Home Sales’ Big Season,"Despite signs of recovery in hard-hit areas, the broader market is far from its nadir, economists say."
nyt://article/eb255720-813e-56ec-912f-a71a68303322,https://www.nytimes.com/2009/03/29/world/asia/29pstan.html,961,World,2009-03-28T23:47:03+0000,Foreign,Pakistan’s President Praises Obama and Offers New Concession to the Opposition,President Asif Ali Zardari promised to ease domestic political turmoil and praised the Obama administration’s new policy to Pakistan as “positive change.”
nyt://article/215db840-fae0-5865-8162-6e6fbdb7b96d,https://www.nytimes.com/2009/02/17/world/asia/17harbin.html,1035,World,2009-02-17T00:48:47+0000,Foreign,A Big Wall Falls in China to Make Room for Mickey,"Trading snow dragons for Snow White, a Disney licensing company took over the Harbin Ice Lantern Festival, China’s most popular wintertime attraction."
nyt://article/3d9dec20-90f9-5bb0-bc50-d79cbddcc4e7,https://www.nytimes.com/2009/03/31/world/asia/31afghan.html,285,World,2009-03-30T13:05:44+0000,Foreign,Suicide Bomber in Kandahar Kills 8,"Afghan police are frequently the target of Taliban attacks, but this attack on a government facility seemed particularly brazen."
nyt://article/dc29bb3f-af11-5264-b59f-9345a9a0a6a1,https://www.nytimes.com/2009/03/22/business/22bosses.html,704,Business Day,2009-03-21T18:58:47+0000,SundayBusiness,The Family Vision,"Sharing her father’s goals, Maureen Beal heads the family business, National Van Lines."
nyt://article/6423396d-a632-553a-8a0c-5ef3358d33ba,https://www.nytimes.com/2009/01/09/business/09digital.html,710,Business Day,2009-01-09T00:33:40+0000,Business,Democrats Seek Delay in TV Shift,"The Obama transition team is seeking to delay the Feb. 17 move to digital TV, saying millions of homes aren’t ready."
nyt://article/57a09c49-ee83-5f3a-9d62-5c68a9a0087b,https://www.nytimes.com/2009/03/19/business/19madoff.html,943,Business Day,2009-03-18T14:39:39+0000,Business,Accountant for Madoff Is Arrested and Charged With Securities Fraud,"The accountant, working out of a tiny storefront office, provided auditing services to Bernard L. Madoff’s investment firm for more than a decade."
nyt://article/84a5187c-ffbf-59aa-8ea8-a6794e0de5b7,https://www.nytimes.com/2009/02/11/world/asia/11correx-001.html,42,World,2009-02-11T03:20:47+0000,Summary,Correction,"An article on Friday about scientific studies that suggested the weight of a large manmade reservoir might have triggered the devastating May 12 earthquake in China’s Sichuan province misspelled the name of the quake’s geological fault line. It is Wenchuan, not Wenchaun."
nyt://article/7fcfd789-9c98-5150-9958-89dc8727714a,https://www.nytimes.com/2009/03/20/world/americas/20briefs-SONOFCARTELL_BRF.html,88,World,2009-03-20T06:13:16+0000,Foreign,Mexico: Son of Cartel Leader Detained,Soldiers and the federal police arrested a leader of the powerful Sinaloa drug cartel in southern Mexico City after receiving tips from residents.
nyt://article/508d1aaa-ad06-53de-9362-fce771778e43,https://www.nytimes.com/2009/01/17/business/media/17weeklies.html,1368,Business Day,2009-01-17T02:52:32+0000,Business,The Popular Newsweekly Becomes a Lonely Category,"The business of telling people what happened in the last week is just about gone, in favor of telling them how to think about the news."
nyt://article/f84654c3-2218-5b14-9c1e-cde35d7b2e79,https://www.nytimes.com/2009/02/23/business/23schapiro.html,1341,Business Day,2009-02-23T00:51:06+0000,Business,S.E.C. Chief Pursues Tougher Enforcement,"After years of rejecting an active securities oversight role, the agency is being transformed by Mary L. Schapiro into a watchdog with teeth."
nyt://article/45848a36-d423-5d6e-be7f-0200f692be09,https://www.nytimes.com/2009/01/06/world/middleeast/06westbank.html,1246,World,2009-01-06T01:48:36+0000,Foreign,"In Fatah-Governed West Bank, Solidarity With Hamas","The Fatah-led Palestinian Authority is deeply worried about popular support for rival Hamas over the conflict in Gaza, to the point of crushing demonstrations."
nyt://article/cf6c4eee-85b4-5ec3-99e8-d435b03b4a14,https://www.nytimes.com/2009/01/09/business/economy/09tarp.html,569,Business Day,2009-01-09T05:07:08+0000,Business,Treasury’s Oversight of Bailout Is Faulted,The Congressional panel overseeing the $700 billion federal bailout has expressed growing concern about the effectiveness and execution of the rescue plan.
nyt://article/8c37deee-3de7-5a1e-87bb-500d8e3b5569,https://www.nytimes.com/2009/03/23/business/media/23adcol.html,918,Business Day,2009-03-23T01:55:01+0000,Business,Madison Avenue’s Chief Seer,"Robert J. Coen, who has been predicting and following trends for advertising spending through 12 presidencies, is stepping down from his post at Interpublic."
nyt://article/c5d18dba-8602-5292-80db-8ec9876f9a1d,https://www.nytimes.com/2009/01/24/world/africa/24zimbabwe.html,1285,World,2009-01-24T02:57:19+0000,Foreign,"Desperate Children Flee Zimbabwe, for Lives Just as Desolate",Children are rushing across the South African border on their own in a journey made dangerous by thieves and rapists.
nyt://article/928af742-b168-57b8-ba2f-8950d0a8f0a2,https://www.nytimes.com/2009/01/07/business/07nissan.html,438,Business Day,2009-01-07T02:21:42+0000,Business,Nissan Asks Its Dealers to Skip Detroit Show,"When Nissan said it would not put up a display at the auto show in Detroit, local dealers decided to do it themselves — until the company intervened."
nyt://article/cb93f215-6264-558c-b3d0-395cb51b3bfa,https://www.nytimes.com/2009/02/06/world/06corrections-02.html,58,World,2009-02-06T03:24:37+0000,Foreign,Corrections,"A report in the World Briefing column on Wednesday about the unusual criticism of Pope Benedict XVI by German Chancellor Angela Merkel over his rehabilitation of a bishop who denied the Holocaust referred incorrectly to her position in the German leadership hierarchy. She is head of government, not head of state. (President Horst Köhler is head of state.)."
nyt://article/f86e1231-30bb-5c28-a1f9-84e3af84a63f,https://www.nytimes.com/2009/02/07/world/africa/07nigeria.html,465,World,2009-02-07T03:15:53+0000,Foreign,84 Children Are Killed by Medicine in Nigeria,"A toxic chemical mixed into a teething medicine for babies has killed at least 84 children in Nigeria, health officials there said."
nyt://article/48ecdbd7-494b-53c2-b652-b9355881fb19,https://www.nytimes.com/2009/01/17/world/asia/17briefs-SECONDCHILDF_BRF.html,100,World,2009-01-17T03:00:58+0000,Foreign,China: Second Child for Quake Families,"Officials said Friday that 757 mothers who lost children in the May 12 earthquake had become pregnant again, according to Xinhua, the state news agency."
nyt://article/345a39cd-849b-59c8-a7dd-2bfcbe33acd9,https://www.nytimes.com/2009/01/27/business/27views.ready.html,755,Business Day,2009-01-27T01:29:33+0000,Business,Bank of America’s Difficult Choice,"Bank of America’s board should show its chief executive the door, and opinion on the Dow Chemical’s acquisition of Rohm and Haas."
nyt://article/c4cf5967-4a28-53c4-a50e-53aeb950837d,https://www.nytimes.com/2009/03/29/world/europe/29sochi.html,208,World,2009-03-28T22:05:51+0000,Foreign,Kremlin Critic on Ballot in Olympic City,"Boris Y. Nemtsov, a longtime opposition leader, is a candidate for mayor of Sochi, which will host the 2014 Winter Olympic Games."
nyt://article/6a947387-0331-5e93-bed7-9f95c8c701ec,https://www.nytimes.com/2009/03/21/your-money/mortgages/21thirty.html,1293,Your Money,2009-03-20T19:39:41+0000,Business,"With Eyes Bigger Than Their Wallets, Homebuyers Are Forced to Revisit Old Rules","Many borrowers have opted to spend far more than a third of their income on mortgage payments, a move that has led to an increase in foreclosures."
nyt://article/e5cae064-3c6e-517d-9619-6843776eef62,https://www.nytimes.com/2009/03/13/business/media/13adco.html,1021,Business Day,2009-03-13T00:46:58+0000,Business,"A Hybrid’s Niche? The Masses, It Hopes","Honda plans to offer the 2010 Insight hybrid for as little as $19,800, thousands below the typical entry point for a hybrid vehicle."
nyt://article/d2deee63-04de-50b8-b4a2-5f8c535811ee,https://www.nytimes.com/2009/02/11/world/americas/11briefs-KIDNAPPINGEP_BRF.html,121,World,2009-02-11T04:48:24+0000,Foreign,Mexico: Kidnapping Episode Leaves 21 Dead,"Soldiers in the state of Chihuahua chased and killed 14 armed men who had kidnapped nine people and killed six of them on Tuesday. One soldier was killed by the kidnappers, believed to be drug traffickers, bringing the death toll to 21. The gunmen took the hostages from the ranching town of Villa Ahumada and drove them to an isolated farm where six were killed, said Enrique Torres, a spokesman for the federal government’s antidrug operation in the state. A military convoy caught up with the kidnappers about 80 miles south of El Paso, killed seven of them and freed the remaining three hostages. Soldiers then pursued the other seven gunmen through heavy snow and killed them in a shootout."
nyt://article/2dc400e2-bab8-5f96-b3ae-ce5e7478313a,https://www.nytimes.com/2009/01/28/world/europe/28noise.html,896,World,2009-01-27T23:32:58+0000,Foreign,Sturm und Drang About Pint-Size Neighbors,A law that seeks to foster both noise abatement and fertility has made a day care center in Germany the target of a lawsuit.
nyt://article/c70980d8-938d-5516-844f-e3f9793257c2,https://www.nytimes.com/2009/03/31/world/middleeast/01iraq.html,434,World,2009-03-31T11:38:48+0000,Foreign,Seven Killed by Truck Bomb in Mosul,The suicide attack on Tuesday took place at the headquarters of a unit of the local police force.
nyt://article/a6c50f48-76aa-5a93-874c-344b0a4554fd,https://www.nytimes.com/2009/02/06/business/worldbusiness/06nuke.html,501,Business Day,2009-02-05T23:34:09+0000,Business,Sweden Takes Another Look at Nuclear Power,"The government proposed refreshing its nuclear reactors, making the nation the latest to consider letting the technology play a major role in its energy plans."
nyt://article/8b27a659-ef0c-564e-b0a5-474d291b0d62,https://www.nytimes.com/2009/03/26/world/africa/26sudan.html,653,World,2009-03-25T12:10:09+0000,Foreign,Egypt Backs Sudanese President,"Egyptian officials welcomed President Omar Hassan al-Bashir of Sudan to Cairo, undeterred by the arrest warrant that has been issued against him for war crimes."
nyt://article/98ff97c5-808a-5932-93ec-8c5e253bda51,https://www.nytimes.com/2009/01/15/technology/personaltech/15gps.html,193,Technology,2009-01-14T21:31:14+0000,Business,Live Connections Keep This GPS Up to Date,"TomTom’s Go 740 Live GPS unit searches for the cheapest nearby gas prices and provides up-to-date, real-time traffic information."
