_id,url,word_count,section,date,type,headline,abstract
nyt://article/b7c224fa-f4d9-5a5f-8ce9-d900344c55ef,https://dealbook.nytimes.com/2009/03/17/greenhill-hires-senior-adviser-for-technology/,55,Business Day,2009-03-17T12:14:44+0000,Business,Greenhill Hires Senior Adviser for Technology,"Greenhill & Company, the boutique investment bank, said on Tuesday that it had hired a longtime veteran of several technology companies as a senior adviser to the firm."
nyt://article/ea6e8349-50ff-514c-bf80-9ddb855aa68c,https://dealbook.nytimes.com/2009/02/09/major-fortis-shareholder-to-vote-against-bnp-deal/,265,Business Day,2009-02-09T11:59:05+0000,Business,Major Fortis Shareholder to Vote Against BNP Deal,"Ping An Insurance, facing a 92 percent decline in the value of its investment in Fortis, said Sunday it would reject the state-organized breakup plan for the Belgian financial services company."
nyt://article/83cd43e5-3c57-5f0e-baea-1cf01cef9337,https://dealbook.nytimes.com/2009/02/09/icelands-baugur-loses-much-of-its-british-empire/,558,Business Day,2009-02-09T12:09:34+0000,Business,Iceland’s Baugur Loses Much of its British Empire,"Baugur Group, an Icelandic investor, ceded control of its holdings in several major British retailers Friday after the main creditor of its British subsidiary, Landsbanki Islands, succeeded in having the unit placed into a form of bankruptcy reorganization."
nyt://article/7b575ddf-0ade-5168-bdf1-009eec915507,https://atwar.blogs.nytimes.com/2009/02/13/out-now-what/,592,World,2009-02-13T11:37:29+0000,Foreign,Out. Now What?,"Despite never having been charged with a crime and losing a year of his life while he waited for the Americans to conclude he should no longer be held, he expresses surprisingly little rancor towards his jailers"
nyt://article/7ec34d95-eb83-5803-bb53-8a26d346257c,https://dealbook.nytimes.com/2009/01/09/dow-gets-eu-appoval-for-rohm-haas-deal/,115,Business Day,2009-01-09T12:09:44+0000,Business,Dow Gets EU Approval for Rohm & Haas Deal,"Dow Chemical, the biggest U.S. chemical maker, got the green light from European regulators for its $15. 4 billion takeover of Rohm & Haas."
nyt://article/eb7c1a10-fbca-5ab4-9abd-69a9eba91d6c,https://dealbook.nytimes.com/2009/03/31/ubs-adds-financial-institutions-bankers/,98,Business Day,2009-03-31T10:29:21+0000,Business,UBS Adds Financial Institutions Bankers,UBS said its investment banking department hired two new managing directors for its financial institutions group.
nyt://article/0b99e1e4-7db5-5ec7-866a-d69b428994c7,https://dealbook.nytimes.com/2009/03/09/barclays-to-buy-specialist-firm-from-jpmorgan/,210,Business Day,2009-03-09T22:46:33+0000,Business,Barclays to Buy Specialist Firm From JPMorgan,Barclays agreed Monday to acquire Bear Wagner Specialists from JPMorgan Chase in a move that will leave the New York Stock Exchange with five designated market makers.
nyt://article/af4c2b63-dcab-5360-a008-2e13f5547673,https://dealbook.nytimes.com/2009/03/09/separation-rule-is-not-the-answer/,632,Business Day,2009-03-09T10:46:16+0000,Business,Separation Rule Is Not the Answer,Why would anybody run a casino and a utility under the same roof?
nyt://article/3d5360ca-ff5c-52f0-ad6e-076b2316974c,https://bits.blogs.nytimes.com/2009/03/09/when-will-the-good-times-return/,251,Technology,2009-03-09T22:02:45+0000,Business,When Will the Good Times Return?,Alibaba’s Jack Ma thinks the recession is going to last a long time. But he says Chinese factories can help American entrepreneurs.
nyt://article/17621f37-2de1-57cc-a51e-fafc7172c9ce,https://dealbook.nytimes.com/2009/01/13/aster-data-raises-12-million/,107,Business Day,2009-01-13T12:15:43+0000,Business,Aster Data Raises $12 Million,"Aster Data Systems, which stores data for social networking site MySpace and others, has raised $12 million in a second round of venture funding, VentureBeat reported."
nyt://article/53e702a7-3c3a-5e0d-b7de-5a7a5424054d,https://rendezvous.blogs.nytimes.com/2009/03/27/global-sports-forum-formula-one-edition/,1857,World,2009-03-27T06:50:40+0000,,Global Sports Forum: Formula One Edition,PART THREE: THE TEAMS
nyt://article/657f3899-7e6d-57f0-9bae-d062004d7edc,https://gadgetwise.blogs.nytimes.com/2009/01/27/panasonic-goes-wide-with-25mm-lenses/,540,Technology,2009-01-27T16:07:35+0000,,Panasonic Goes Wide With 25mm Lenses,Panasonic’s new digital cameras offer ultra-wide-angle lenses.
nyt://article/40dac995-b2cb-524a-adfd-94b68de7c7df,https://dealbook.nytimes.com/2009/01/21/jhl-capital-reports-gains-of-up-to-18/,307,Business Day,2009-01-21T22:29:57+0000,Business,JHL Capital Reports Gains of Up to 18%,"John Paulson isn’t the only hedge fund manager to come out of 2008 with big profits. The Chicago-based JHL Capital Group, a small firm run by James H. Litinsky, chalked up gains of 17.1 percent to 18 percent net of fees last year despite the global stock market meltdown, according to a letter the firm sent to clients on Tuesday. "
nyt://article/22ba4f6f-4dcf-5b1e-ba4d-690e020183e1,https://dealbook.nytimes.com/2009/01/15/another-view-advice-on-lawyers-for-madoff-investors/,2485,Business Day,2009-01-15T22:29:22+0000,Business,Another View: Advice on Lawyers for Madoff Victims,"Eric M. Rosenberg, an attorney and president of LitigationProofing, a firm that helps companies limit exposure to potential lawsuits, offers this view of what Bernard L. Madoff’s investors should consider when they are choosing lawyers to seek recovery of their money:"
nyt://article/36b3daa3-4b97-5d81-9b8c-b05b61cc2351,https://gadgetwise.blogs.nytimes.com/2009/01/13/new-sdxc-memory-cards-to-hit-2-terabytes/,336,Technology,2009-01-13T19:57:27+0000,,New SDXC Memory Cards to Hit 2 Terabytes,New XDSC memory cards will offer 2 terabytes of storage.
nyt://article/222eb9d9-bfef-5cd6-8f58-eac5b17aed1a,https://dealbook.nytimes.com/2009/03/17/adding-up-aigs-backdoor-bailouts/,491,Business Day,2009-03-17T18:30:43+0000,Business,Adding Up A.I.G.’s Backdoor Bailouts,"Of the $170 billion in government funds used to prop up American International Group, a large chunk has gone to buy soured securities — at full price — from big banks like Goldman Sachs."
nyt://article/6a8384f7-446e-5e88-9811-fcfe53cc10da,https://dealbook.nytimes.com/2009/01/09/after-madoff-regulatory-oversight-of-auditors-is-back/,347,Business Day,2009-01-09T12:02:56+0000,Business,"After Madoff, Regulatory Oversight of Auditors Is Back","The Securities and Exchange Commission has quietly backed away from a rule that had allowed the accounting firm that audited Bernard L. Madoff Investment Securities to avoid oversight by a regulator that was created after the Enron and WorldCom scandals, The New York Times’s Floyd Norris reported."
nyt://article/dbe6cadf-927a-5b6a-a6dc-5b7ac6d86ec8,https://dealbook.nytimes.com/2009/02/13/large-banks-on-the-edge-of-insolvency/,1235,Business Day,2009-02-13T11:30:44+0000,Business,Solvency of Big Banks Is Questioned,"Some of the nation’s large banks, according to economists and other finance experts, are like dead men walking, The New York Times’s Steve Lohr reports."
nyt://article/bf0e06b5-b3a8-59f0-8011-b11a24cb3ea5,https://dealbook.nytimes.com/2009/03/24/dr-doom-finds-promise-in-obamas-toxic-asset-plan/,565,Business Day,2009-03-24T22:23:56+0000,Business,Dr.  Doom Finds Promise in Obama’s Toxic-Asset Plan,"Nouriel Roubini, a/k/a “Dr. Doom,” is giving the Obama administration’s new plan to buy toxic assets the thumbs up. "
nyt://article/3d8e1a27-67d5-549b-9ec6-b4b5ee58ecef,https://gadgetwise.blogs.nytimes.com/2009/01/16/from-dealbook-circuit-city-to-liquidate/,151,Technology,2009-01-16T16:42:24+0000,,From DealBook: Circuit City to Liquidate,"The nation’s number-two tech retailer is seeking court approval to shut down, says our blog-cousin DealBook."
nyt://article/e7bceb40-8c84-51f2-b95f-e5f1daa7899b,https://gadgetwise.blogs.nytimes.com/2009/02/27/a-laptop-thats-bulked-up/,264,Technology,2009-02-27T18:57:39+0000,,A Laptop That’s Bulked Up,Asus’s new widescreen laptop is anything but portable.
nyt://article/34d89225-552f-5995-baf3-8e3de330c5d9,https://dealbook.nytimes.com/2009/02/26/big-win-in-delaware-for-corporate-boards/,1323,Business Day,2009-02-26T14:51:30+0000,Business,Big Win in Delaware for Corporate Boards,"On Tuesday, Chancellor William B. Chandler III dismissed all but one of the claims in a shareholder suit in the Delaware Chancery Court against the board of Citigroup. The shareholders principally alleged that the Citi board had breached their fiduciary duties by allowing the company to invest in, and sustain significant losses in, the subprime lending market."
nyt://article/e0c8bb34-6402-5936-bbb8-86154b09b89b,https://dealbook.nytimes.com/2009/03/27/germanys-westlb-plans-auction/,243,Business Day,2009-03-27T12:05:56+0000,Business,Germany’s WestLB Plans Auction,German state-owned bank WestLB said Thursday that it was looking to sell itself off in an auction process after repeated efforts to merge with other financial institutions were ruled out amid the continuing financial crisis.
nyt://article/47b95334-5003-5bd7-a517-db06af82549f,https://dealbook.nytimes.com/2009/01/07/exelon-claims-46-of-nrg-shares-in-hostile-tender-offer/,292,Business Day,2009-01-07T19:16:05+0000,Business,Exelon Claims 46% of NRG Shares in Hostile Tender Offer,"The battle between Exelon and NRG heated up on Wednesday, after Exelon said that it has garnered nearly 46 percent of its fellow power company’s stock through a hostile tender offer."
nyt://article/abde7ab7-bdae-551d-acfa-a6cc7f7ec317,https://atwar.blogs.nytimes.com/2009/02/18/coming-to-america/,588,World,2009-02-18T16:50:35+0000,Foreign,Coming to America,"Many of my colleagues who want to go to the States are wondering about their futures there, especially after the problems with the economy."
nyt://article/e0190880-971b-5a16-badb-247eb1a44ce5,https://bits.blogs.nytimes.com/2009/03/05/the-nations-new-chief-information-officer-speaks/,652,Technology,2009-03-05T19:57:38+0000,Business,The Nation’s New Chief Information Officer Speaks,"Vivek Kundra, the new federal chief information officer, wants to bring the latest technological trends, from smart phones to cloud computing, to the federal government."
nyt://article/cc748ea5-093d-5819-8836-23d2045b3b7b,https://dealbook.nytimes.com/2009/03/13/nasdaq-eyes-european-deal/,56,Business Day,2009-03-13T11:40:16+0000,Business,Nasdaq Eyes European Deal,"Nasdaq OMX plans to acquire an alternative trading platform in Europe, the U.S.-based group said on Thursday."
nyt://article/94255127-669b-5340-b767-f3ba4c025a72,https://dealbook.nytimes.com/2009/02/09/amid-hits-to-industry-owl-creek-says-its-ok/,299,Business Day,2009-02-09T17:36:05+0000,Business,"Amid Hits to Industry, Owl Creek Says It’s OK","While some hedge fund managers have been left apologizing for their performance last year, those who lost less than 10 percent are breathing a sigh of relief."
nyt://article/8f6bc3e7-1c42-57cd-8ea9-e4cb4e0655be,https://dealbook.nytimes.com/2009/03/17/madoffs-wife-seeks-shelter-in-florida-home/,209,Business Day,2009-03-17T20:05:39+0000,Business,Madoff’s Wife Seeks Shelter in Florida Home,"The wife of the admitted swindler Bernard L. Madoff has declared her estate in Palm Beach, Fla., as her primary residence, in a move that may shield the $9.4 million home from creditors."
nyt://article/67088653-3de1-5106-b879-8b00bf4db2ad,https://bits.blogs.nytimes.com/2009/02/12/hps-hunk-of-burning-light/,610,Technology,2009-02-12T22:14:57+0000,Business,H.P.’s Hunk of Burning Light,Hewlett-Packard is developing a new generation of optical components that could make computers thousands of times faster.
nyt://article/180ee970-28ba-5b4a-8ae8-1bba62b6d5ba,https://dealbook.nytimes.com/2009/01/15/parsing-pandit-how-soon-is-now/,484,Business Day,2009-01-15T14:10:38+0000,Business,Parsing Pandit: How Soon Is Now?,"Citigroup is back in the vortex, and suddenly its chief executive, Vikram Pandit, is in a hurry to get some news out the door. Jack Flack parses his memo to employees."
nyt://article/94c02785-a8a7-5a56-9883-fbd2f10443a7,https://dealbook.nytimes.com/2009/02/11/lawmakers-challenge-bankers-on-bailout/,977,Business Day,2009-02-11T22:58:15+0000,Business,Lawmakers Challenge Bankers on Bailout,"Eight of the nation’s top bankers faced off Wednesday against critical lawmakers in Congress, who questioned their use of tens of billions of dollars of taxpayer money and pointed out the growing public anger at the banks in the bailout, The New York Times’s Louise Story reports from Washington."
nyt://article/70bdb375-a557-51b3-a649-b6655bc24933,https://dealbook.nytimes.com/2009/02/23/european-airlines-may-push-for-us-deals/,131,Business Day,2009-02-23T11:53:27+0000,Business,European Airlines May Push for U.S. Deals,"Last year, the Open Skies Treaty between the U.S. and European Union opened new routes across the Atlantic, in what was seen mainly as a win for U.S. airlines wanting access to European hubs. "
nyt://article/00c8bd5e-c3da-5fc1-93ba-c5248cb935d0,https://dealbook.nytimes.com/2009/03/25/another-view-curbing-mobocracy-with-competence/,1331,Business Day,2009-03-25T19:59:17+0000,Business,Another View: Curbing ‘Mobocracy’ With Competence,"Jeffrey Sonnenfeld, senior associate dean of the Yale School of Management, offers this view of the Obama administration’s role in the bonus uproar. Update on March 26: Mr. Sonnenfeld posted a reply addressing many of the comments on this post. "
nyt://article/ad9bd49c-2f1d-551d-ab59-8dc4bc407b61,https://dealbook.nytimes.com/2009/02/19/carlyle-offers-imo-creditors-cash-to-keep-control/,77,Business Day,2009-02-19T12:33:19+0000,Business,Carlyle Group Offers Cash to IMO Carwash Creditors,"The Carlyle Group has offered to pay $36 million to keep control of IMO Carwash, in return for the company’s creditors writing off debt, The Financial Times reported."
nyt://article/043a6112-3ec3-5a9c-aefa-433289acfd2d,https://dealbook.nytimes.com/2009/01/28/in-dispute-oil-tycoon-seeks-gaylord-board-seats/,474,Business Day,2009-01-28T22:25:39+0000,Business,Oil Tycoon Seeks Gaylord Board Seats,"The Texas oil billionaire Robert B. Rowling nominated himself and three other candidates to the board of the hotel operator Gaylord Entertainment on Wednesday, following through with a promise he made earlier this month in a letter sharply criticizing the company."
nyt://article/92523d30-aed9-5601-86dd-d5055aaa3282,https://dealbook.nytimes.com/2009/02/18/nrg-blasts-exelon-bid-as-deadline-approaches/,669,Business Day,2009-02-18T18:04:00+0000,Business,NRG Blasts Exelon Bid as Deadline Approaches,"NRG Energy is stepping up its efforts to fend off a hostile takeover attempt from Exelon, a rival power operator, ahead of next week’s deadline for NRG shareholders to tender their stock."
nyt://article/46afcb52-d798-5202-80b0-b36231abe033,https://dealbook.nytimes.com/2009/02/09/hedge-fund-lets-investors-withdraw-what-is-left/,442,Business Day,2009-02-09T12:10:25+0000,Business,Pershing Fund Lets Investors Withdraw,"In a move that could force similar changes at other money-losing hedge funds, the well-known fund manager William A. Ackman is cutting his fees and allowing investors to take what is left of their money from one of the funds he manages, The New York Times’s Zachery Kouwe reported."
nyt://article/125011cc-e74e-58f8-8b2e-2dff109a1348,https://dealbook.nytimes.com/2009/03/02/aig-smackdown-liddy-vs-greenberg/,324,Business Day,2009-03-02T22:53:16+0000,Business,A.I.G. Smackdown: Liddy vs. Greenberg,"Edward M. Liddy, the chief executive of the American International Group, clashed Monday with his predecessor, Maurice R. Greenberg."
nyt://article/3bac1e44-407b-5cfa-bf2c-8a5bac8c3516,https://dealbook.nytimes.com/2009/01/14/former-chief-of-autodesk-takes-reins-at-yahoo/,1188,Business Day,2009-01-14T11:39:57+0000,Business,Former Chief of Autodesk Takes Reins at Yahoo,"In tapping Carol Bartz as Yahoo’s new chief executive on Tuesday, the company’s board has selected a seasoned manager and tough-minded technology executive who established Autodesk, the maker of design software, as a market leader and successfully steered it through a boom and bust cycle, The New York Times’s Miguel Helft writes."
nyt://article/f2cfbd68-cb56-56dc-8ea9-e3581655b55b,https://dealbook.nytimes.com/2009/02/06/for-paulson-15-billion-on-the-line-in-dow-deal/,266,Business Day,2009-02-06T12:29:10+0000,Business,"For Paulson, $1.5 Billion on the Line in Dow Deal",Just how much is Dow Chemical‘s deal for Rohm & Haas worth to John Paulson?
nyt://article/34301b0d-d8a0-5518-86c5-f6abc5dc053e,https://dealbook.nytimes.com/2009/03/04/ford-moves-to-restructure-its-debt/,367,Business Day,2009-03-04T22:38:21+0000,Business,Ford Moves to Restructure Its Debt,"The Ford Motor Company said Wednesday afternoon that it intended to eliminate as much as $10.4 billion in debt by giving cash and shares of its stock to creditors, The New York Times’s Nick Bunkley and Bill Vlasic reported from Detroit."
nyt://article/0a49a371-2112-5285-92e3-51fbed65e3da,https://dealbook.nytimes.com/2009/02/03/professors-come-to-cubans-defense/,113,Business Day,2009-02-03T12:58:05+0000,Business,Professors Come to Cuban’s Defense,"Mark Cuban has lined up a roster of Ivy League professors to take his part in his battle against the Securities and Exchange Commission, which has accused the investor of trading on insider information."
nyt://article/26f1683f-51b6-57bf-b25c-c0b27107361a,https://dealbook.nytimes.com/2009/01/15/did-madoff-trade-any-stocks-evidence-is-lacking/,391,Business Day,2009-01-15T19:44:52+0000,Business,Did Madoff Trade Any Stocks? Evidence Is Lacking,"The disgraced financier Bernard L. Madoff, accused of securities fraud, appears to have been running a pure Ponzi scheme because industry regulators have been unable to find evidence of any actual stock trades."
nyt://article/b40cbe16-7afd-52b3-8e96-f1f253471620,https://dealbook.nytimes.com/2009/03/25/are-those-bank-assets-really-so-toxic/,397,Business Day,2009-03-25T16:04:10+0000,Business,Are Those Bank Assets Really So Toxic?,"Richard X. Bove, the banking analyst, argues that New York Times columnist Paul Krugman and others are overstating the amount of unrecognized losses lurking on banks’ balance sheets."
nyt://article/5ebf665a-164a-5ae3-810b-f790f19cbebe,https://dealbook.nytimes.com/2009/03/04/tensions-flare-in-philadelphia-newspapers-bankruptcy/,564,Business Day,2009-03-04T20:20:36+0000,Business,Tensions Flare in Philadelphia Newspapers Bankruptcy,"The case of Philadelphia Newspapers, the company that owns The Philadelphia Inquirer and The Philadelphia Daily News, appears to be quickly turning into a brawl."
nyt://article/5cacc472-cece-5fbd-b5f2-7f375d946453,https://dealbook.nytimes.com/2009/01/22/senators-seek-more-funds-to-fight-financial-fraud/,323,Business Day,2009-01-22T16:58:34+0000,Business,Senators Seek More Funds to Fight Financial Fraud,"Charles E. Schumer, the Democratic senator from New York, and Richard Shelby, a Republican senator from Alabama, are expected to introduce new spending legislation on Thursday designed to beef up enforcement and detection of white-collar crime in the wake of the $50 billion fraud allegedly perpetrated by Bernard L. Madoff."
nyt://article/908c1ac5-cbb0-5bc8-9e76-d56664c884df,https://mediadecoder.blogs.nytimes.com/2009/03/17/ratings-dancing-draws-11-million-to-castle/,210,Business Day,2009-03-17T19:52:39+0000,Media,Ratings: ‘Dancing’ Draws 11 Million to ‘Castle’,"Week two of “Dancing With the Stars” remained dominant in the ratings on Monday, garnering 21.1 million viewers from 8 to 10 p.m., according to Nielsen’s estimates."
nyt://article/b0dbd7dd-718b-5f00-9599-0f5c1113e062,https://dealbook.nytimes.com/2009/03/19/its-the-regulations-not-the-regulator/,582,Business Day,2009-03-19T13:06:50+0000,Business,"It’s the Regulations, Not the Regulator","It has become a truism of the financial crisis that the system was prone to collapse because there was no single regulator who had the legal tools and authority to prevent a meltdown. That belief has led to calls from some lawmakers and major banks, among others, for a new “systemic risk regulator” — one regulator to monitor the entire financial landscape for problems that could lead to cascading failures, The New York Times’s editorial board writes."
nyt://article/f042ae78-c9ca-5358-8b03-0b5408458891,https://executivesuite.blogs.nytimes.com/2009/02/13/a-few-new-ideas-to-help-tim-geithner/,518,Business Day,2009-02-14T00:25:17+0000,,A Few New Ideas to Help Tim Geithner,Some ideas about how to price toxic assets and how to make a public-private partnership work on a “bad bank.”
nyt://article/89d32c79-817a-595a-b6c9-0a74fd86d64d,https://executivesuite.blogs.nytimes.com/2009/03/27/im-just-a-cockeyed-optimist/,296,Business Day,2009-03-27T23:44:47+0000,,I’m Just a Cockeyed Optimist,Taking a second look at the Geithner plan for toxic assets.
nyt://article/ea01dbf9-7c02-57c1-8cae-189814bbcaff,https://dealbook.nytimes.com/2009/01/14/blocks-of-stock-hard-to-unload/,384,Business Day,2009-01-14T11:37:30+0000,Business,"Blocks of Stock, Hard to Unload",Block trades are back. 
nyt://article/d596fdb8-836f-54c1-ba4d-b5f412649931,https://economix.blogs.nytimes.com/2009/01/08/a-little-late-and-meaningless-too/,247,Business Day,2009-01-09T01:10:34+0000,Business,"A Little Late, and Meaningless, Too","Accounting firms that audit broker-dealers will now have to register with the Public Company Accounting Oversight Board. They were already required to do that by one section of the Sarbanes-Oxley law, which created the board, but the Securities and Exchange Commission waived that requirement for brokers that did not issue publicly traded securities."
nyt://article/6e5c4fc2-d552-5a5c-acdc-99bc81e14690,https://bits.blogs.nytimes.com/2009/02/11/despite-troubles-tesla-ceo-promises-profitability-this-year/,582,Technology,2009-02-11T23:02:22+0000,Business,"Despite Troubles, Tesla C.E.O. Promises Profitability This Year",Tesla chief Elon Musk says the troubled electric car start-up will be profitable this summer and step up its business selling batteries to other car companies.
nyt://article/3a0c3c46-d7e6-5dd6-813d-6ec0cd3d7c7d,https://economix.blogs.nytimes.com/2009/01/07/a-corporate-hero-admits-fraud/,230,Business Day,2009-01-07T18:06:38+0000,Business,A Corporate Hero Admits Fraud,The winner of the “golden Peacock” award for corporate governance turns out to be a fraud.
nyt://article/013da8f3-ab6b-5559-94a5-821e826d270e,https://dealbook.nytimes.com/2009/01/13/alitalia-sells-a-stake-as-it-makes-its-return/,484,Business Day,2009-01-13T11:26:33+0000,Business,Alitalia Sells a Stake as It Makes Its Return,"The Italian airline Alitalia agreed Monday to sell a minority stake to Air France-KLM, cementing ties with the airline just a day before Alitalia takes to the skies as a leaner, more cost-efficient airline, Caroline Brothers of The New York Times reported."
nyt://article/5ecad965-5be2-5dc8-a1cd-a92d65c12976,https://dealbook.nytimes.com/2009/03/20/many-in-government-knew-weeks-ago-about-aig-bonuses/,891,Business Day,2009-03-20T11:25:31+0000,Business,Officials Knew About A.I.G. Bonuses Weeks Ago,"The question was direct and prescient. Representative Joseph Crowley, Democrat of New York, asked the Treasury secretary in an open hearing what could be done to stop American International Group from paying $165 million in bonuses to hundreds of employees in the very unit that had nearly destroyed the company."
nyt://article/64ebc95f-e6fd-5c6e-89f6-0e25916c9125,https://dealbook.nytimes.com/2009/03/04/ex-leaders-of-countrywide-profit-from-bad-loans/,1446,Business Day,2009-03-04T12:34:13+0000,Business,Ex-Leaders of Countrywide Profit From Bad Loans,"Fairly or not, Countrywide Financial and its top executives would be on most lists of those who share blame for the nation’s economic crisis. After all, the banking behemoth made risky loans to tens of thousands of Americans, helping set off a chain of events that has the economy staggering."
nyt://article/548a4a9b-c2c0-5ab0-afc7-20972609cf2f,https://gadgetwise.blogs.nytimes.com/2009/01/12/new-toys-for-ithings/,292,Technology,2009-01-13T00:25:01+0000,,New Toys for iThings,New accessories for dressing up your iStuff.
nyt://article/306b18ea-ee91-5f80-acd7-aaa474026992,https://dealbook.nytimes.com/2009/03/26/dreier-trustee-recovers-100-million-in-assets/,723,Business Day,2009-03-26T10:50:06+0000,Business,Dreier Trustee Recovers $100 Million in Assets,"An official appointed to recover the assets of Marc S. Dreier, the Manhattan lawyer accused of defrauding hedge funds of at least $400 million, says he has safeguarded more than $100 million in assets, including an $18.5 million yacht, The Associated Press reported."
nyt://article/1e5a1618-de16-5942-b3e1-57d6ccdf86be,https://bits.blogs.nytimes.com/2009/03/03/jeff-bewkes-goes-over-the-top/,358,Technology,2009-03-03T12:07:46+0000,Business,Time Warner Goes Over the Top,"The head of Time Warner says the company will let people subscribe to its networks, like CNN and TNT, over the Internet without using a cable or satellite company."
nyt://article/40add15b-0297-51d1-8db8-fe23143429f5,https://gadgetwise.blogs.nytimes.com/2009/01/23/the-impossible-happens/,292,Technology,2009-01-23T22:47:20+0000,,Electronics Companies Lose Big: Do You Win?,"Consumer electronics companies post operating losses, putting added pressure on third-tier TV manufacturers."
