_id,url,word_count,section,date,type,headline,abstract
nyt://article/78ba8edd-e0e6-5319-a766-e8455d411239,https://economix.blogs.nytimes.com/2009/01/21/stimulus-plans-might-do-good-but-not-actually-stimulate/,681,Business Day,2009-01-21T11:00:11+0000,Business,"Stimulus Plans Might ‘Do Good,’ but Not Actually Stimulate","When the government hires employees or makes purchases, the ultimate economic effect of these actions depends on what private sector activity is displaced, an economist writes."
nyt://article/ffa41cea-122e-5517-830e-298fc01a48a0,https://bits.blogs.nytimes.com/2009/03/06/citi-urges-myspace-users-to-spend-wisely/,571,Technology,2009-03-07T01:43:58+0000,Business,Citi Urges MySpace Users to Spend Wisely,"Citigroup, a recipient of three taxpayer bailouts, is using a new credit card to teach MySpace users about fiscal responsibility."
nyt://article/d3c98c0b-3240-5e54-ad4b-330faeb67c17,https://dealbook.nytimes.com/2009/03/30/ubs-ousts-top-banker-who-served-us-clients/,300,Business Day,2009-03-30T10:32:46+0000,Business,UBS Ousts Top Banker Who Served U.S. Clients,"UBS, the Swiss bank under a growing federal investigation for tax fraud, has forced out the executive formerly in charge of secret offshore accounts for wealthy Americans, the bank said Sunday, according to The New York Times’s Lynnley Browning."
nyt://article/4fed57bf-4633-5ac6-89ae-dd884fd3fad6,https://dealbook.nytimes.com/2009/03/19/citi-said-to-plan-10-million-office-overhaul/,350,Business Day,2009-03-19T14:35:29+0000,Business,Citi Plans Elaborate Office Consolidation,"In a move bound to feed public furor over perks at bailed-out banks, Citigroup is planning to spend about $10 million on new offices for its chief executive and his lieutenants, a project that calls for premium millwork and at least on Sub-Zero refrigerator."
nyt://article/5bf5e37f-4c29-5dcb-816d-55abd6257828,https://economix.blogs.nytimes.com/2009/02/12/the-ultimate-growth-industry/,627,Business Day,2009-02-12T15:23:39+0000,Business,The Ultimate Growth Industry,"For a long-term investment in a socially responsible growth industry offering consistently high returns, an economist recommends public spending on early childhood education."
nyt://article/d7c65a6a-560b-5777-b875-8c1f51736d74,https://mediadecoder.blogs.nytimes.com/2009/01/12/abc-may-bring-millionaire-back-to-prime-time/,73,Business Day,2009-01-12T11:13:19+0000,Media,ABC May Bring ‘Millionaire’ Back to Prime Time,ABC may present a primetime revival of the game show “Who Wants to Be a Millionaire” this summer.
nyt://article/ec876900-1b7a-5673-ad75-a1d167050f76,https://economix.blogs.nytimes.com/2009/01/13/economic-art/,92,Business Day,2009-01-14T01:08:07+0000,Business,Economic Art,"The work of German artist Andreas Nicolas Fischer, whose work is inspired by economic data."
nyt://article/a03c2cc0-7947-5d91-9591-b4dcc0609141,https://gadgetwise.blogs.nytimes.com/2009/01/07/the-69-cent-itune-unrestricted/,406,Technology,2009-01-07T05:10:30+0000,,"The 69-Cent iTune, Unrestricted","Apple makes it easier to copy iTunes, and restructures download pricing."
nyt://article/4fcf9f2f-3201-5aa3-bd07-21bee0387808,https://bits.blogs.nytimes.com/2009/03/11/greystripe-raises-money-to-peddle-ads-in-cellphone-games/,487,Technology,2009-03-11T13:00:16+0000,Business,Greystripe Raises Money to Peddle Ads in Cellphone Games,"Greystripe, which raised $5.5 million in additional funding, says that Web ads work just as well on iPhones."
nyt://article/25328c06-bcec-5543-8f21-4df476ea8c4c,https://dealbook.nytimes.com/2009/01/12/aboutus-banks-5-million-in-funding/,274,Business Day,2009-01-12T11:42:04+0000,Business,AboutUs Banks $5 Million in Funding,"AboutUs, the wiki that’s working to capture detailed information about every site on the Web, has secured $5 million in Series A funding. The round was led by Voyager Capital with a $2.5 million investment, ReadWriteWeb reported."
nyt://article/f233a9a3-a35a-518c-a72b-d7b2b932b708,https://dealbook.nytimes.com/2009/01/23/weekend-thoughts-on-deals-big-and-small/,1742,Business Day,2009-01-23T21:12:16+0000,Business,Weekend Thoughts on Deals Big and Small,"This last week has seen some blockbuster news in the form of Merrill Lynch/Bank of America, Steven P. Jobs/Apple and, of course, the inauguration of President Obama. In the wake of these stories, you might have missed some of the smaller occurrences of the week. So I thought I would bring you up to date. Nonetheless, I can’t resist starting with some brief thoughts on Bank of America and the continuing allegations of nondisclosure."
nyt://article/28064a6f-e56a-5f90-ba0d-fd0fbfadfe1b,https://dealbook.nytimes.com/2009/03/12/another-view-the-government-is-madoffs-biggest-winner/,845,Business Day,2009-03-12T13:30:10+0000,Business,Another View: The Government Is Madoff’s Biggest Winner,"Andrew N. Lerman, a certified public accountant in White Plains, N.Y., argues that the biggest beneficiary of the Bernard L. Madoff scandal was the federal government through the taxes it collected. Mr. Lerman, who is working for several victims of the fraud, has spoken to several United States senators, including Robert Menendez, Democrat of New Jersey and Charles Schumer, Democrat of New York."
nyt://article/90c57615-9f1b-597e-bd69-5b2c33b23ef0,https://dealbook.nytimes.com/2009/01/22/merrill-reportedly-paid-bonuses-early-as-merger-closed/,354,Business Day,2009-01-22T14:39:37+0000,Business,Merrill Reportedly Paid Bonuses Early as Merger Closed,The controversy over Bank of America‘s acquisition of Merrill Lynch appeared to grow on Thursday with a report in the Financial Times that Merrill paid out billions of dollars in bonuses to its employees three days before the sale went through — and well before it has paid out bonuses in previous years.
nyt://article/6078ded9-28fc-5977-8898-714878925d65,https://economix.blogs.nytimes.com/2009/02/18/obamas-housing-plan-who-will-benefit/,571,Business Day,2009-02-18T18:57:05+0000,Business,Obama’s Housing Plan: Who Will Benefit?,The president says he wants to help people who played by the rules and not those who bought more home than they could afford. His plan will help both.
nyt://article/17400f70-78fc-5c9f-98d2-da4ac474e375,https://economix.blogs.nytimes.com/2009/02/04/losses-mount-up/,248,Business Day,2009-02-04T17:31:39+0000,Business,Losses Mount Up,"For the first time, the Standard & Poor’s 500 is on its way to a quarter in which the component companies will report overall losses rather than profits."
nyt://article/4f99971c-6445-57e8-b145-eea1da64770e,https://bits.blogs.nytimes.com/2009/02/12/leds-good-housekeeping-seal/,328,Technology,2009-02-12T11:19:01+0000,Business,LED’s Good Housekeeping Seal,LED lighting products are now eligible to receive the government’s Energy Star imprimatur.
nyt://article/6f3de9c6-46fb-55f7-90ff-a7f4fd7eadf8,https://gadgetwise.blogs.nytimes.com/2009/02/23/for-windows-7-beta-updates-to-download/,149,Technology,2009-02-23T23:04:03+0000,,"For Windows 7 Beta, Updates to Download",More updates for the next generation Windows OS.
nyt://article/daa0d46e-d773-5e3f-841e-d85d60cf70fe,https://dealbook.nytimes.com/2009/02/26/of-twitter-stocks-and-public-offerings/,156,Business Day,2009-02-26T12:56:00+0000,Business,"Of Twitter, Stocks and Public Offerings","Initial public offerings are an endangered species on Wall Street these days — especially for untested, and often unprofitable, venture-backed companies."
nyt://article/fbad8824-6720-58b2-ba64-3e6b4e677b19,https://dealbook.nytimes.com/2009/02/05/a-push-to-free-capital-for-emerging-markets/,686,Business Day,2009-02-05T11:57:14+0000,Business,A Push to Free Capital for Emerging Markets,"With governments focused on shoring up domestic lending, the world’s major financial businesses are pushing to help the flow of financing to subsidiaries in emerging markets like Eastern Europe, The New York Times’s Matthew Saltmarsh writes."
nyt://article/db6bbbc5-3ffe-5ccd-bdad-50d9b4cd4437,https://dealbook.nytimes.com/2009/02/04/witness-on-madoff-tells-of-fear-for-safety/,444,Business Day,2009-02-04T12:43:05+0000,Business,Witness on Madoff Tells of Fear for Safety,"The man who tried unsuccessfully for almost a decade to spur federal securities regulators to investigate Bernard L. Madoff did not initially disclose his own identity to regulators because he feared for his life, reports Diana B. Henriques in The New York Times, according to testimony he has apparently prepared for a Congressional hearing Wednesday morning."
nyt://article/f05368d0-dc53-5176-b5a0-017a601f37f5,https://dealbook.nytimes.com/2009/02/20/in-2nd-inquiry-ubs-finds-itself-in-a-bind/,660,Business Day,2009-02-20T12:09:00+0000,Business,"In 2nd Inquiry, UBS Finds Itself in a Bind",The UBS memo was blunt: the “Swiss solution” could help affluent Americans.
nyt://article/3cea87e9-cc5f-5f89-9431-d872b27bbaee,https://bits.blogs.nytimes.com/2009/02/11/netbooks-a-curse-or-a-blessing-in-an-imploding-pc-market/,434,Technology,2009-02-11T18:11:15+0000,Business,Netbooks: A Curse or a Blessing in an Imploding PC Market?,"Sales of PC chips fell off a cliff in the fourth quarter, but they would have been worse without the boom in netbooks."
nyt://article/37561aa3-a0dd-5624-b9e2-b0b5c5b0e19e,https://economix.blogs.nytimes.com/2009/01/06/can-business-do-well-and-do-good/,919,Business Day,2009-01-06T11:30:20+0000,Business,Can Businesses Do Well and Do Good?,"An economist discusses how ethical businesses should be, in light of their duties to their shareholders and to “the greater good.”"
nyt://article/14be4df0-266b-5523-b512-a6372687799b,https://dealbook.nytimes.com/2009/01/29/wachovia-acquisition-drags-down-wells-fargo/,639,Business Day,2009-01-29T11:38:38+0000,Business,Wachovia Acquisition Drags Down Wells Fargo,Wells Fargo‘s $2.55 billion fourth-quarter loss on Wednesday is the first sign that its hurried acquisition of the troubled Wachovia Corporation would be a long and difficult struggle.
nyt://article/4c67b4d9-d1f7-5313-8da8-8e46e0b9fcf0,https://dealbook.nytimes.com/2009/02/17/fosters-decides-to-keep-wine-business-after-all/,109,Business Day,2009-02-17T11:53:55+0000,Business,Foster’s Decides to Keep Wine Business After All,"Foster’s Group, Australia’s biggest brewer, will retain its global wine business because the worldwide economic recession is making it difficult to find a buyer. "
nyt://article/8361f993-a904-571e-9e29-c428e7b8ac21,https://gadgetwise.blogs.nytimes.com/2009/02/27/new-sony-tv-models-worth-the-wait/,243,Technology,2009-02-27T17:02:00+0000,,New Sony TV Models: Worth the Wait?,"Sony will introduce its new 2009 HDTV lineup this Monday, but a web site has already leaked prices and some features for its sets."
nyt://article/02a89584-052a-53d1-9a11-65e508d0b884,https://dealbook.nytimes.com/2009/02/04/volcker-suggests-ways-to-refine-bank-regulations/,690,Business Day,2009-02-04T22:39:45+0000,,Volcker Suggests Ways to Refine Bank Regulations,"Paul A. Volcker, the former Federal Reserve chairman who is leading President Obama’s Economic Recovery Advisory Board, called Wednesday for fundamental changes in the regulation of financial instruments and institutions, especially of those firms whose collapse can put the financial system at risk, The New York Times’s Sharon Otterman reports."
nyt://article/168e0881-d306-5e5b-b240-660187e08a1b,https://dealbook.nytimes.com/2009/02/25/valin-takes-stake-in-fortescue-for-798-million/,93,Business Day,2009-02-25T12:02:51+0000,Business,Valin Buys Stake in Fortescue for $798 Million,China’s Hunan Valin Iron and Steel Group is spending 1.24 billion Australian dollars ($798 million) to build a 16.5 percent stake in Australia’s Fortescue Metals.
nyt://article/5d6a6359-952e-5659-b848-bd098f988138,https://dealbook.nytimes.com/2009/01/16/executive-shake-up-at-ivy-asset-management/,252,Business Day,2009-01-17T01:54:57+0000,Business,Executive Shake-Up at Ivy Asset Management,"The Bank of New York Mellon Corporation’s hedge fund unit, Ivy Asset Management, has shaken up its executive ranks and retooled its compensation plan as it tries to navigate the broad changes sweeping the battered hedge fund industry."
nyt://article/c1a462f7-4a2c-5f20-897e-79ab40124a17,https://dealbook.nytimes.com/2009/02/23/ing-reviewing-its-us-options-report-says/,394,Business Day,2009-02-23T11:54:53+0000,Business,"ING Reviews Its U.S. Options, Report Says","ING Group is gauging the implications of the U.S. bank rescue aid plan announced earlier this month for its activities there, the Dutch banking and insurance group’s next chief executive told a Dutch newspaper Saturday, Reuters said."
nyt://article/de3f325b-4207-5b7e-a095-d722829c8f9a,https://economix.blogs.nytimes.com/2009/01/20/lower-and-more-realistic-presidential-expectations/,794,Business Day,2009-01-20T11:00:49+0000,Business,Lower (and More Realistic) Presidential Expectations,"Today a new presidency begins, carrying with it the hopes of millions throughout the world. President Obama is a remarkable person, but he would be better served with a narrower, and more reasonable, set of job expectations, an economist writes."
nyt://article/c4eeda2b-d331-5619-ab91-79bf092e31d0,https://economix.blogs.nytimes.com/2009/01/02/booze-indicators/,355,Business Day,2009-01-02T17:45:22+0000,Business,Wine as an Economic Indicator,The relationship between alcohol sales and the economy.
nyt://article/b4e12910-fd98-5a9e-bf50-86ab44a6b90d,https://dealbook.nytimes.com/2009/03/30/fifth-third-sells-stake-in-processing-unit-to-buyout-shop/,143,Business Day,2009-03-30T11:21:19+0000,Business,Fifth Third Sells Stake in Processing Unit to Buyout Shop,"Fifth Third Bancorp said on Monday that it had signed a deal to sell a 51 percent stake in its payment processing unit to a private equity firm, Advent International, for $561 million."
nyt://article/9daaa1ae-8561-5d3a-9c90-ae438fa1798f,https://mediadecoder.blogs.nytimes.com/2009/01/08/abc-pursues-television-widgets/,312,Business Day,2009-01-08T17:27:55+0000,Media,ABC Pursues Television Widgets,Fans of ABC’s “Lost” and “Good Morning America” – and perhaps executives at rival networks – may want to pay careful attention to an idea the Walt Disney Company plans to discuss at the Consumer Electronics Show on Thursday afternoon.
nyt://article/2f3cc6d7-ba68-5807-a63e-6b223cbb7d71,https://bits.blogs.nytimes.com/2009/03/02/microsoft-live-search-in-quest-of-new-name-and-design/,407,Technology,2009-03-03T03:54:08+0000,Business,Microsoft Live Search in Quest for New Name and Design,"Microsoft is testing a new design for its search engine, which it plans to rename. Kumo.com is one possibility to replace the Windows Live Search brand."
nyt://article/55bb97c1-8d05-5fb4-a0f5-5e91b2fda5ff,https://dealbook.nytimes.com/2009/03/13/icahn-says-he-has-no-plans-to-shop-lions-gate/,696,Business Day,2009-03-13T11:19:01+0000,Business,Icahn Says He Has No Plans to Shop Lions Gate,"Carl C. Icahn, the activist investor, said he had no plans to push for a sale of Lions Gate Entertainment in the current environment, but he criticized the Hollywood studio’s expenses for being too high and called its purchase of TV Guide “reckless,” Reuters reported."
nyt://article/0242635e-9528-5a81-b81c-bce636df6814,https://dealbook.nytimes.com/2009/03/20/auto-parts-suppliers-may-get-aid/,792,Business Day,2009-03-20T11:35:18+0000,Business,Auto Parts Suppliers May Get Aid,The Obama administration signaled its intent Thursday to provide broad relief to the American auto industry with the creation of a $5 billion fund to aid troubled parts suppliers.
nyt://article/e99f6fd9-89e2-51f2-89e0-de47663d50b0,https://dealbook.nytimes.com/2009/02/13/citadel-keeps-gates-up-but-sets-redemption-plan/,242,Business Day,2009-02-13T17:47:20+0000,,"Citadel Keeps Gates Up, but Sets Redemption Plan","Citadel Investment Group has decided to continue suspending redemptions from its two largest funds for another quarter after freezing them last year, but will institute a new program to allow withdrawals."
nyt://article/9a576008-0f56-5596-b816-8e5ff5e37a4f,https://mediadecoder.blogs.nytimes.com/2009/01/14/hbo-to-show-sundays-inaugural-event-live/,63,Business Day,2009-01-15T00:26:51+0000,Media,HBO to Show Sunday’s Inaugural Event Live,HBO’s exclusive telecast of the opening celebration for Barack Obama’s inauguration will now be shown live.
nyt://article/53e702a7-3c3a-5e0d-b7de-5a7a5424054d,https://rendezvous.blogs.nytimes.com/2009/03/27/global-sports-forum-formula-one-edition/,1857,World,2009-03-27T06:50:40+0000,,Global Sports Forum: Formula One Edition,PART THREE: THE TEAMS
nyt://article/657f3899-7e6d-57f0-9bae-d062004d7edc,https://gadgetwise.blogs.nytimes.com/2009/01/27/panasonic-goes-wide-with-25mm-lenses/,540,Technology,2009-01-27T16:07:35+0000,,Panasonic Goes Wide With 25mm Lenses,Panasonic’s new digital cameras offer ultra-wide-angle lenses.
nyt://article/40dac995-b2cb-524a-adfd-94b68de7c7df,https://dealbook.nytimes.com/2009/01/21/jhl-capital-reports-gains-of-up-to-18/,307,Business Day,2009-01-21T22:29:57+0000,Business,JHL Capital Reports Gains of Up to 18%,"John Paulson isn’t the only hedge fund manager to come out of 2008 with big profits. The Chicago-based JHL Capital Group, a small firm run by James H. Litinsky, chalked up gains of 17.1 percent to 18 percent net of fees last year despite the global stock market meltdown, according to a letter the firm sent to clients on Tuesday. "
nyt://article/22ba4f6f-4dcf-5b1e-ba4d-690e020183e1,https://dealbook.nytimes.com/2009/01/15/another-view-advice-on-lawyers-for-madoff-investors/,2485,Business Day,2009-01-15T22:29:22+0000,Business,Another View: Advice on Lawyers for Madoff Victims,"Eric M. Rosenberg, an attorney and president of LitigationProofing, a firm that helps companies limit exposure to potential lawsuits, offers this view of what Bernard L. Madoff’s investors should consider when they are choosing lawyers to seek recovery of their money:"
nyt://article/36b3daa3-4b97-5d81-9b8c-b05b61cc2351,https://gadgetwise.blogs.nytimes.com/2009/01/13/new-sdxc-memory-cards-to-hit-2-terabytes/,336,Technology,2009-01-13T19:57:27+0000,,New SDXC Memory Cards to Hit 2 Terabytes,New XDSC memory cards will offer 2 terabytes of storage.
nyt://article/222eb9d9-bfef-5cd6-8f58-eac5b17aed1a,https://dealbook.nytimes.com/2009/03/17/adding-up-aigs-backdoor-bailouts/,491,Business Day,2009-03-17T18:30:43+0000,Business,Adding Up A.I.G.’s Backdoor Bailouts,"Of the $170 billion in government funds used to prop up American International Group, a large chunk has gone to buy soured securities — at full price — from big banks like Goldman Sachs."
nyt://article/6a8384f7-446e-5e88-9811-fcfe53cc10da,https://dealbook.nytimes.com/2009/01/09/after-madoff-regulatory-oversight-of-auditors-is-back/,347,Business Day,2009-01-09T12:02:56+0000,Business,"After Madoff, Regulatory Oversight of Auditors Is Back","The Securities and Exchange Commission has quietly backed away from a rule that had allowed the accounting firm that audited Bernard L. Madoff Investment Securities to avoid oversight by a regulator that was created after the Enron and WorldCom scandals, The New York Times’s Floyd Norris reported."
nyt://article/dbe6cadf-927a-5b6a-a6dc-5b7ac6d86ec8,https://dealbook.nytimes.com/2009/02/13/large-banks-on-the-edge-of-insolvency/,1235,Business Day,2009-02-13T11:30:44+0000,Business,Solvency of Big Banks Is Questioned,"Some of the nation’s large banks, according to economists and other finance experts, are like dead men walking, The New York Times’s Steve Lohr reports."
nyt://article/bf0e06b5-b3a8-59f0-8011-b11a24cb3ea5,https://dealbook.nytimes.com/2009/03/24/dr-doom-finds-promise-in-obamas-toxic-asset-plan/,565,Business Day,2009-03-24T22:23:56+0000,Business,Dr.  Doom Finds Promise in Obama’s Toxic-Asset Plan,"Nouriel Roubini, a/k/a “Dr. Doom,” is giving the Obama administration’s new plan to buy toxic assets the thumbs up. "
nyt://article/3d8e1a27-67d5-549b-9ec6-b4b5ee58ecef,https://gadgetwise.blogs.nytimes.com/2009/01/16/from-dealbook-circuit-city-to-liquidate/,151,Technology,2009-01-16T16:42:24+0000,,From DealBook: Circuit City to Liquidate,"The nation’s number-two tech retailer is seeking court approval to shut down, says our blog-cousin DealBook."
nyt://article/9f580f47-cddc-5d2e-91d1-db9855af1cd7,https://dealbook.nytimes.com/2009/03/19/madoff-lawyer-presses-case-for-bail/,671,Business Day,2009-03-19T15:50:57+0000,Business,Madoff Lawyer Presses Case for Bail,"Bernard L. Madoff’s lawyer asked a three-judge panel on Thursday to restore his bail while he awaits sentencing in a $65 billion Ponzi scheme, but the prosecution asserted that the risk of flight dictated his continued detention."
nyt://article/f24d765f-a7f2-5ba4-83f9-252fe2c452cc,https://gadgetwise.blogs.nytimes.com/2009/02/04/the-240-gigabyte-ipod-debuts-sort-of/,270,Technology,2009-02-04T22:27:07+0000,,"The 240-Gigabyte iPod Has a Debut, Sort Of",Rapid Repair will upgrade fifth-generation iPods to a new 240-gigabyte hard drive.
nyt://article/22c7ddad-0135-55cb-8cfe-1b709e78e776,https://dealbook.nytimes.com/2009/03/18/goldman-answers-aig-questions-and-raises-new-ones/,380,Business Day,2009-03-18T14:21:02+0000,Business,Goldman Answers A.I.G. Questions and Raises New Ones,"Goldman Sachs offered some more details about its positions with American International Group, but the explanations raised new questions as well."
nyt://article/8eab91c6-dce7-59b2-9539-1ccff47aff16,https://dealbook.nytimes.com/2009/03/30/rep-bachus-on-bailouts-bankruptcy-and-bonuses/,1977,Business Day,2009-03-30T16:02:44+0000,Business,"Rep. Bachus on Bailouts, Bonuses and Bankruptcy","In an interview with DealBook, Spencer Bachus, the ranking member of the House Financial Services Committee, expressed support for reforming Wall Street but criticized the secrecy of federal bailouts and efforts to set the terms of executive pay."
nyt://article/64c5df5f-4efc-54a1-a7d8-f9efef5f4bde,https://bits.blogs.nytimes.com/2009/02/16/sas-warms-to-open-source-one-letter-at-a-time/,409,Technology,2009-02-16T19:16:41+0000,Business,SAS Warms to Open-Source One Letter at a Time,The world’s largest statistics company is ready to give the open-source and beloved R programming language a shot.
nyt://article/7da12009-59e2-5e0d-9d80-33779fb81b6e,https://dealbook.nytimes.com/2009/03/04/icahn-puts-another-250-million-into-his-fund/,583,Business Day,2009-03-04T19:29:57+0000,Business,Icahn Puts Another $250 Million Into His Fund,"The billionaire financier Carl C. Icahn put another $250 million into his hedge fund at the beginning of the year after suffering further losses in the fourth quarter on investments in Motorola and Yahoo, according to a letter he sent to investors."
nyt://article/12fae2d1-8edd-5e06-a1f6-5fec35bd1959,https://dealbook.nytimes.com/2009/01/07/learning-from-ge-as-spin-season-approaches/,1109,Business Day,2009-01-07T22:00:03+0000,Business,Learning From G.E. as Spin Season Approaches,"As companies prepare for a new season of investor updates, they would do well to consider a recent conference call by General Electric‘s Jeffrey Immelt, Jack Flack says."
nyt://article/330e263e-7e63-5034-a5c9-aa1cd34ff896,https://economix.blogs.nytimes.com/2009/03/13/cost-effectiveness-analysis-and-us-health-care/,752,Business Day,2009-03-13T10:45:51+0000,Business,‘Cost-Effectiveness Analysis’ and U.S. Health Care,"An economist discusses two politically-sensitive health care ideas that were in play during drafts of the stimulus bill, and explains why only one of those proposals actually made it to the final version of the bill."
nyt://article/74fb464c-1733-54e5-999c-0e7df0e24634,https://economix.blogs.nytimes.com/2009/01/28/economists-sound-off-at-davos/,227,Business Day,2009-01-28T20:42:39+0000,Business,Economists Sound Off at Davos,"Reporting from the World Economic Forum in Davos, CNBC interviewed a number of prominent economists and business leaders about the global financial crisis and what can be done."
nyt://article/51249850-e9f6-53db-b903-b5acceab7894,https://dealbook.nytimes.com/2009/02/17/insana-to-leave-sac-capital/,267,Business Day,2009-02-17T21:11:51+0000,Business,Insana to Leave SAC Capital,"Ron Insana, the former CNBC anchor, has decided to leave his post at SAC Capital just six months after he was hired as a managing director, a person briefed on the matter told DealBook."
nyt://article/e5f24394-5830-5427-98bd-87a07d6628ee,https://dealbook.nytimes.com/2009/01/15/all-bernie-all-the-time/,127,Business Day,2009-01-15T11:30:22+0000,Business,"All Bernie, All the Time",From Floyd Norris at Notions on High and Low Finance:
nyt://article/603a4a45-2984-5b2c-ad18-623d4e4a582e,https://dealbook.nytimes.com/2009/02/06/satyam-names-chief-and-secures-bank-loans/,301,Business Day,2009-02-06T11:48:51+0000,Business,Satyam Names Chief and Secures Bank Loans,"Satyam Computer Services, the computer outsourcing company, has appointed a chief executive and secured $130 million in bank loans in the wake of a $1 billion fraud scandal, the company’s board said Thursday."
nyt://article/5411d4c8-811b-59f6-be08-beb815eac48c,https://dealbook.nytimes.com/2009/01/27/halliburton-to-pay-559-million-to-settle-bribery-probe/,130,Business Day,2009-01-27T12:35:04+0000,Business,Halliburton to Pay $559 Million to Settle Bribery Probe,"Halliburton will pay a $559 million fine to end an investigation of its former KBR unit if the U.S. government approves the settlement, the largest penalty against a U.S. company for charges of bribery under federal law."
