_id,url,word_count,section,date,type,headline,abstract
nyt://article/0afa4bf6-4048-5327-85c4-e4245c6a5aab,https://atwar.blogs.nytimes.com/2010/07/27/pakistan-media-say-reports-on-leaked-documents-unfairly-malign-spy-agency/,642,World,2010-07-27T23:30:23+0000,Foreign,Pakistan Media Say Reports on Leaked Documents Unfairly Malign Spy Agency,Pakistani talk shows and newspapers took a largely defensive stance in reaction to the leak of thousands of classified military documents and the implication that Pakistan’s spy agency has aided Afghan insurgents.
nyt://article/1fccc809-f3bb-5fe8-bd7a-5118aa49d41b,https://dealbook.nytimes.com/2010/09/14/philadelphia-papers-go-back-on-auction-block/,576,Business Day,2010-09-14T22:50:57+0000,Business,Philadelphia Papers Go Back on Auction Block,Philadelphia’s two major newspapers go on the auction block again next week after their creditors failed to close on their planned $139 million purchase by Tuesday’s deadline.
nyt://article/559bf8dc-b977-5a45-a56a-058061823bb5,https://gadgetwise.blogs.nytimes.com/2010/07/05/q-a-reporting-e-mail-scams-and-spoofs/,188,Technology,2010-07-05T11:24:46+0000,,Q.&A.: Reporting E-Mail Scams and Spoofs,How to report e-mail scams and spoofs.
nyt://article/90cb0e6b-bb6c-558a-909f-78dcfb14dc84,https://dealbook.nytimes.com/2010/07/19/an-outspoken-fund-manager-with-contrarian-views/,937,Business Day,2010-07-19T18:35:12+0000,Business,London’s Contrarian Fund Manager,Hugh Hendry says he thinks China’s growth is almost over and would short President Obama if he could.
nyt://article/00a95544-25ea-5b6d-82b5-9123df7b963c,https://dealbook.nytimes.com/2010/08/12/morning-take-out-64/,160,Business Day,2010-08-12T12:09:53+0000,Business,Morning Take-Out,"DealBook’s links from around the Web for Thursday, Aug. 12, including Goldman Sachs’s fascination with jeggings and a requiem for Yahoo."
nyt://article/29c5a4eb-04ab-5c7e-9c03-3a5496187e31,https://mediadecoder.blogs.nytimes.com/2010/07/26/choose-your-own-adventure-series-turns-a-page/,298,Business Day,2010-07-26T08:15:54+0000,,Choose Your Own Adventure Series Turns a Page,"Edward Packard, a writer for the Choose Your Own Adventure series, is creating interactive books to be formatted as applications for the iPhone or iPad."
nyt://article/9568081c-7e51-5435-b4ab-f1711d56674a,https://dealbook.nytimes.com/2010/07/30/republicans-block-bill-to-aid-small-business/,445,Business Day,2010-07-30T08:25:24+0000,Business,Republicans Block Bill to Aid Small Business,"Senate Republicans on Thursday rejected a bill to aid small businesses with expanded loan programs and tax breaks, in a procedural blockade that underscored how fiercely determined the party’s leaders are to deny Democrats any further legislative accomplishments ahead of November’s midterm elections."
nyt://article/7dfe6fc7-cb78-54ca-98ad-10fc4add467d,https://dealbook.nytimes.com/2010/09/30/treasury-reaps-billions-as-it-sells-its-citi-shares/,351,Business Day,2010-09-30T23:54:02+0000,Business,Treasury Reaps Billions as It Sells Its Citi Shares,"The Treasury Department has sold more than half its stake in Citigroup, which it acquired as part of the bank’s $45 billion bailout, and it expects the government to make a good profit from its investment."
nyt://article/58dec4ee-dc98-5446-ad4a-4a9de61b9584,https://mediadecoder.blogs.nytimes.com/2010/09/27/study-finds-that-apple-dominates-tech-news/,344,Business Day,2010-09-27T04:13:35+0000,,Study Finds That Apple Dominates Tech News,The company effectively seizes journalists’ attention and makes events out of its product introductions.
nyt://article/3bb66877-51c7-5ed7-b1f3-df44065793ac,https://dealbook.nytimes.com/2010/09/10/wall-street-extends-its-rally/,136,Business Day,2010-09-10T05:21:02+0000,Business,Wall Street Extends Its Rally,Stocks extended their September rally on Thursday after more encouraging news on the job market.
nyt://article/f0fe109c-764b-5311-824f-35ea8560a475,https://economix.blogs.nytimes.com/2010/08/26/fiscal-austerity-and-americas-future/,952,Business Day,2010-08-26T10:00:18+0000,Business,Fiscal Austerity and America’s Future,"Don’t let scaremongers about deficits set the agenda for addressing budget issues, an economist urges."
nyt://article/1f666c80-381a-52c2-a0bc-d096e7bf4d55,https://dealbook.nytimes.com/2010/08/02/goldmans-expensive-tastes-anger-n-y-c-neighbors/,247,Business Day,2010-08-02T11:05:35+0000,Business,Goldman’s Expensive Tastes Anger N.Y.C. Neighbors,"Goldman Sachs’s plan to replace the unglamorous businesses outside its new headquarters with a string of designer restaurants and a luxury hotel has seen locals up in arms, accusing the bank of “breaking promises,” The Telegraph reports."
nyt://article/e4274284-2964-5646-84eb-83c8a253295f,https://rendezvous.blogs.nytimes.com/2010/07/16/schumacher-prepares-for-an-emotional-return-to-germany-with-mercedes/,275,World,2010-07-16T15:45:18+0000,,Schumacher Prepares for an Emotional Return to Germany with Mercedes,Michael Schumacher expresses his delight at returning to the Hockenheim track in Germany for his and his Mercedes team’s home race next weekend.
nyt://article/8737bb2a-d095-5169-b288-b1961325307f,https://atwar.blogs.nytimes.com/2010/07/20/a-city-tour-for-v-i-p-s-attending-the-kabul-conference/,1160,World,2010-07-20T22:08:30+0000,Foreign,A City Tour for V.I.P.’s Attending the Kabul Conference,"Not a day goes by that someone doesn’t say, “How can this be, that America has been here for nine years, and there are still streets like this?”"
nyt://article/84919b3c-49d0-5e15-b1fd-c503bd945796,https://dealbook.nytimes.com/2010/08/11/ex-forbes-com-c-e-o-raises-funds-for-web-publishing/,161,Business Day,2010-08-11T08:19:51+0000,Business,Ex-Forbes.com Chief Raises Funds for Web Publishing,"Spanfeller Media Group, the startup founded by former Forbes.com chief executive Jim Spanfeller, confirmed Tuesday that it has raised $2 million in funding, VentureBeat reported."
nyt://article/55b2de7d-31c9-5448-b404-c10aac5f3929,https://dealbook.nytimes.com/2010/08/30/axa-halves-its-goldman-holdings-in-quarter/,134,Business Day,2010-08-30T10:01:32+0000,Business,AXA Halves Its Goldman Holdings in Quarter,"AXA, the giant French insurer and once the largest shareholder in Goldman Sachs, cut its holdings in the investment bank in half over the last quarter, The Financial Times reported."
nyt://article/efd12290-3449-5cb5-903d-7e84b60986c0,https://dealbook.nytimes.com/2010/08/02/get-a-diploma-but-then-get-a-passport/,144,Business Day,2010-08-02T05:22:22+0000,Business,"Get a Diploma, but Then Get a Passport","Quintin E. Primo III, the chief of Capri Capital Partners, says new college graduates should leave the United States to broaden their cultural horizons."
nyt://article/f0c79370-e48f-5974-9497-598a7b078064,https://dealbook.nytimes.com/2010/09/20/i-s-s-backs-burkle-slate-for-barnes-nobles-board/,577,Business Day,2010-09-20T12:32:32+0000,Business,I.S.S. Backs Burkle Slate for Barnes & Noble’s Board,"Institutional Shareholder Services, the powerful proxy advisory firm, on Monday backed a slate of directors proposed by the billionaire investor Ron Burkle for Barnes & Noble’s board, dealing a blow to the bookseller in its proxy fight."
nyt://article/dc791d70-e023-5f37-94c0-2b068f1a31de,https://dealbook.nytimes.com/2010/07/02/lions-gate-goes-for-poison-pill-again/,366,Business Day,2010-07-02T11:22:35+0000,Business,Lions Gate Goes for Poison Pill (Again),"As Carl C. Icahn moved to increase his position in Lions Gate Thursday, the movie studio hit back with a maneuver of its own: a poison pill designed to thwart the billionaire investor’s attempt to win control of the Santa Monica-based studio."
nyt://article/2e45212c-a9e7-5f6d-af1e-5d8acd9e61ee,https://dealbook.nytimes.com/2010/07/26/icahn-sues-lions-gate-over-move-to-block-his-bid/,375,Business Day,2010-07-26T17:46:24+0000,Business,Icahn Sues Lions Gate Over Move to Block His Bid,"The billionaire investor Carl C. Icahn sued Lions Gate Entertainment on Monday, accusing the movie studio of employing “scorched-earth tactics” to block his hostile takeover bid."
nyt://article/2d82c12f-45cb-5946-9172-337f21652660,https://dealbook.nytimes.com/2010/08/05/tesla-reports-higher-losses-in-2nd-quarter/,177,Business Day,2010-08-05T11:28:45+0000,Business,Tesla Reports Higher Losses in 2nd Quarter,"Tesla Motors, Elon Musk’s Silcon Valley-based electric car firm, has posted its earnings for the second quarter — the first since it became a public company — and losses are up."
nyt://article/436892eb-35d1-5644-a5cc-fc2b97591d8d,https://dealbook.nytimes.com/2010/07/19/reald-raises-200-million-in-i-p-o/,109,Business Day,2010-07-19T11:30:09+0000,Business,RealD Raises $200 Million in I.P.O.,"Shares in RealD, which licenses the 3-D technology used by a majority of movie theater chains in the United States, spiked more 21 percent in the company’s market debut Friday."
nyt://article/f6a97a2b-914e-564d-b8a0-9676dfcceca7,https://dealbook.nytimes.com/2010/08/09/female-entrepreneurs-on-the-rise/,183,Business Day,2010-08-09T09:31:25+0000,Business,Female Entrepreneurs on the Rise,"Ready to break down the historic gender imbalance in high-tech entrepreneurship, a new wave of female entrepreneurs is getting into position, The Silicon Valley Mercury News wrote."
nyt://article/11754f62-5a74-5928-95f7-738bc91f323b,https://bits.blogs.nytimes.com/2010/08/02/no-e-books-allowed-in-this-establishment/,499,Technology,2010-08-02T22:01:12+0000,Business,No E-Books Allowed in This Establishment,Some coffee shops ban computers — and even e-book readers. But reading devices are not going away.
nyt://article/7605f048-0554-5c08-8642-00ca5e9623dc,https://dealbook.nytimes.com/2010/08/17/santander-and-mt-bank-said-to-re-open-talks/,142,Business Day,2010-08-17T09:38:28+0000,Business,Santander and M&T Bank Said to Re-Open Talks,"Santander has renewed talks to merge its American operations with M&T Bank, a midsize New York lender, The Financial Times reported."
nyt://article/9cdd2c18-1e09-569e-83eb-93ea63ff961a,https://bucks.blogs.nytimes.com/2010/09/28/401k-expenses-inch-slightly-higher/,534,Your Money,2010-09-28T19:05:50+0000,,401(k) Expenses Inch Slightly Higher,"Though 401(k) investors pay less for their investments, on average, than the typical investor, costs rose slightly because of the market downturn."
nyt://article/30a5bc30-6bec-5eed-9571-68f9729accc3,https://bits.blogs.nytimes.com/2010/07/01/amazon-introduces-a-new-kindle-dx-with-lower-price/,140,Technology,2010-07-01T05:16:20+0000,Business,Amazon Introduces a New Kindle DX With Lower Price,Amazon refreshes the Kindle DX.
nyt://article/d519dfc6-ee96-50f8-a851-1ef3c9fc8c7e,https://bits.blogs.nytimes.com/2010/07/21/bits-pics-robot-competitions/,144,Technology,2010-07-21T21:20:17+0000,Business,Bits Pics: Robot Competitions,"Images from China’s National Robot Competition, held in Beijing."
nyt://article/cfe92d7f-90c6-5252-a367-089417a47bee,https://gadgetwise.blogs.nytimes.com/2010/09/30/an-ipod-dock-that-shuffles-a-duo-of-devices/,325,Technology,2010-09-30T21:39:12+0000,,An iPod Dock That Shuffles a Duo of Devices,An Altec Lansing iPod dock shuffles between two iPods as they shuffle.
nyt://article/5ff387a5-2249-5a9a-9e67-fdac9b5e9818,https://bucks.blogs.nytimes.com/2010/08/18/how-mutual-fund-managers-are-like-cigarette-makers/,445,Your Money,2010-08-18T16:39:47+0000,,How Mutual Fund Managers Are Like Cigarette Makers,Excerpts from an e-mail in which the founders of MarketRiders equate mutual fund managers to tobacco pushers.
nyt://article/eda96d73-02cd-560a-930a-e1c531b65acd,https://mediadecoder.blogs.nytimes.com/2010/09/30/boston-globe-to-start-a-paid-web-site/,466,Business Day,2010-09-30T16:57:11+0000,,Boston Globe to Start a Paid Web Site,"The Boston Globe, part of The New York Times Company, announced on Thursday that it would start a new paid Web site in the second half of 2011."
nyt://article/207f2969-000d-5cd5-b73d-4cf7fa20bc93,https://boss.blogs.nytimes.com/2010/08/24/here-are-my-three-problems-this-week/,667,Business Day,2010-08-24T11:00:28+0000,Business,Here Are My Three Problems This Week,"On hiring the right person, paying the right wages, and managing sales people."
nyt://article/bfccf890-62f2-5f49-ab1a-aba8444ba77d,https://bits.blogs.nytimes.com/2010/07/19/apple-iphone-4-press-conference-fallout/,386,Technology,2010-07-19T19:14:00+0000,Business,Fallout From the iPhone 4 Press Conference,An Apple press conference that was meant to ease concerns over the iPhone 4’s antenna problems set off more debate.
nyt://article/da291aa2-c4ae-556b-9afd-8e3aae950fc5,https://economix.blogs.nytimes.com/2010/08/02/the-financial-earthquake-finding-a-new-economics-in-the-rubble/,637,Business Day,2010-08-02T19:39:44+0000,Business,The Financial Earthquake: Finding a New Economics in the Rubble,Calling the recent financial crisis an “earthquake” may be a more apropos nickname than many people realize.
nyt://article/f6bf2f10-e97c-5ebe-8f40-386917d59fde,https://dealbook.nytimes.com/2010/08/16/buyback-window-opened-by-dodd-frank/,144,Business Day,2010-08-16T09:57:45+0000,Business,Buyback Window Opened by Dodd-Frank,"A 90-day securities buyback window has been opened by the new financial reform bill. This will allow banks to buy back $118 billion in high-cost securites and to replace the instruments with cheaper capital, The Financial Times reported."
nyt://article/3a1400bb-8087-566c-9828-6f1a174b4cad,https://dealbook.nytimes.com/2010/08/26/santander-suspends-analyst-charged-by-s-e-c/,356,Business Day,2010-08-26T08:22:38+0000,Business,Santander Suspends Analyst Charged by S.E.C.,Grupo Santander said Wednesday that it had suspended the bank employee charged by the Securities and Exchange Commission with trading on insider information about BHP Billiton’s $39 billion bid for Potash Corp.
nyt://article/4ea933b5-37f1-550c-84e8-7c6c29b8e1b1,https://dealbook.nytimes.com/2010/08/20/k-n-o-c-makes-2-9-billion-bid-for-dana/,182,Business Day,2010-08-20T06:57:41+0000,Business,K.N.O.C. Makes $2.9 Billion Bid for Dana,"Korea National Oil Corp. made its hostile bid for Dana Petroleum public on Friday, offering £1.87 billion cash to the holders of Dana shares and convertible bonds."
nyt://article/bd51bc26-5496-5ddc-92a7-91426ae6a822,https://pogue.blogs.nytimes.com/2010/07/15/at-snopes-com-rumors-are-held-up-to-the-light/,1643,Technology,2010-07-15T18:17:44+0000,,"At Snopes.com, Rumors Are Held Up to the Light","David Pogue interviews David Mikkelson of Snopes.com, where Internet veterans go to get the truth about online rumors."
nyt://article/96f35504-0a5d-5566-b1dd-5a0b82b42a08,https://dealbook.nytimes.com/2010/09/13/primus-said-to-plan-appeal-of-taiwans-a-i-g-ruling/,117,Business Day,2010-09-13T09:06:34+0000,Business,Primus Said to Plan Appeal of Taiwan’s A.I.G. Ruling,"Primus Financial Holdings, one of the bidders for American International Group’s Taiwan unit, will appeal the regulator’s decision to block the deal, a newspaper reported on Monday."
nyt://article/b6ec8d6c-0c3b-52f9-a6cc-fb5d5876a865,https://dealbook.nytimes.com/2010/08/20/for-intel-a-merger-of-fish-and-fowl/,143,Business Day,2010-08-20T08:37:22+0000,Business,"For Intel, a Merger of Fish and Fowl",Intel is betting that combining McAfee’s security software with its hardware will give it a leg up. But investors who knocked down Intel’s shares are rightly skeptical the chip maker can pull it off.
nyt://article/c6cb1530-eb81-5ffb-aaf2-2ab336440be1,https://dealbook.nytimes.com/2010/09/07/barclays-names-diamond-c-e-o-green-to-head-ministry/,101,Business Day,2010-09-07T09:43:45+0000,Business,Barclays Names Diamond as Its New Chief,"As head of Barclays’ securities unit, Mr. Diamond, 59, helped turn the bank into a global brand with the acquisition of Lehman Brothers’ operation in the United States. He was also responsible for much of the company’s international and financial growth in the last decade."
nyt://article/43578fb9-7577-5ddc-a9fa-a284c98ac07f,https://mediadecoder.blogs.nytimes.com/2010/09/23/will-mow-lawns-for-lone-star-eyeballs/,402,Business Day,2010-09-23T22:51:09+0000,,Will Mow Lawns for ‘Lone Star’ Eyeballs,The creator of the Texas soap opera “Lone Star” goes looking for viewers.
nyt://article/83d91bcf-336e-53f7-b663-e021593115d8,https://dealbook.nytimes.com/2010/09/29/mcclure-to-google-buy-twitter/,237,Business Day,2010-09-29T09:49:13+0000,Business,McClure to Google: Buy Twitter,"Google has been told by Dave McClure to get out the checkbook and buy Twitter: “Whatever your math is, you better do it soon, because you’re getting killed by Facebook.”"
nyt://article/a101f914-9767-5676-b4e8-bd10e7e8ef28,https://dealbook.nytimes.com/2010/07/26/basel-group-reaches-accord-on-bank-capital-rules/,194,Business Day,2010-07-26T19:55:14+0000,Business,Basel Group Reaches Accord on Bank Capital Rules,The group of governors and heads of supervision who oversee the Basel Committee on Banking Supervision said that they had reached a “broad agreement” on the “overall design” of new capital and liquidity rules for banks.
nyt://article/c8455b1e-6910-55dd-9ea7-cbc1ba757a9c,https://dealbook.nytimes.com/2010/08/20/hearing-date-set-in-stuyvesant-town-suit/,83,Business Day,2010-08-20T10:12:09+0000,Business,Hearing Date Set in Stuyvesant Town Suit,"After being sued by lenders of the Stuyvesant Town-Peter Cooper Village, William Ackman’s plans to foreclose on the apartment complex have been put on hold."
nyt://article/8ed30faf-f7ab-5e58-aefa-b7a674a55154,https://economix.blogs.nytimes.com/2010/07/23/what-were-reading-divorce-tourism/,83,Business Day,2010-07-23T20:43:58+0000,Business,What We’re Reading: Divorce Tourism,Links from around the Web.
nyt://article/3393feae-55b4-5c40-a349-c21e2909c374,https://dealbook.nytimes.com/2010/07/21/europe-hopes-tests-help-banks-as-they-did-in-u-s/,965,Business Day,2010-07-21T15:20:20+0000,Business,Europe Hopes Tests Help Banks as They Did in U.S.,American regulators gave investors a lift when their stress tests showed that banks could weather a long downturn — a feat that Europe hopes to duplicate.
nyt://article/62da0448-9db2-564a-966a-b463830dba32,https://dealbook.nytimes.com/2010/09/09/falling-rates-aid-debtors-but-hamper-savers/,263,Business Day,2010-09-09T04:41:34+0000,Business,"Falling Rates Aid Debtors, but Hamper Savers","Those who live off their savings and investments are hit hard by falling interest rates, as corporations borrow cheaply and sit on the cash."
nyt://article/4de8833b-107c-5d14-b4ed-141161d43ca7,https://dealbook.nytimes.com/2010/09/24/morning-take-out-92/,117,Business Day,2010-09-24T12:10:52+0000,Business,Morning Take-Out,"“Inside Job,” a review; Ron Conway to angels: drop dead; the dangers of index-linked investing."
nyt://article/28157fb4-1d71-533a-bab2-96eeeefa21d8,https://bits.blogs.nytimes.com/2010/09/20/t-mobile-blocks-text-messages/,524,Technology,2010-09-20T21:33:06+0000,,T-Mobile Sued Over Blockade of Text Messages,Ez Texting claims that T-Mobile set up a blockade  to keep its phone subscribers from signing up for messages from an Ez Texting client that lists marijuana dispensaries and reviews.
nyt://article/c7d27042-9572-5708-8648-7a8ac193fc85,https://economix.blogs.nytimes.com/2010/07/07/dont-expect-a-full-labor-market-recovery/,615,Business Day,2010-07-07T10:00:34+0000,Business,Don’t Expect a Full Labor-Market Recovery,"Job-market growth should keep up with population growth, an economist writes, but don’t expect a whole lot more."
nyt://article/b2958ad1-90e2-5f02-9f7c-34054f305278,https://dealbook.nytimes.com/2010/07/19/bankers-worried-over-european-bank-stress-tests/,191,Business Day,2010-07-19T09:32:12+0000,Business,Bankers Worried Over European Bank Stress Tests,"Senior bankers and regulators across Europe are worried that markets could misinterpret the outcome of a test of how resilient European banks are to economic shocks, The Financial Times reported."
nyt://article/05116e36-fa5d-5841-adae-0617e62581de,https://dealbook.nytimes.com/2010/09/17/spains-a-c-s-confirms-3-53-billion-bid-for-hochtief/,165,Business Day,2010-09-17T08:30:49+0000,Business,Spain’s A.C.S. Confirms $3.53 Billion Bid for Hochtief,The Spanish construction firm Actividades de Construcción y Servicios confirmed Thursday that it had offered 2.7 billion euros ($3.53 billion) to gain full control of its German rival Hochtief.
nyt://article/912e5844-6f27-5e4f-a76c-3535aa9857f1,https://dealbook.nytimes.com/2010/08/09/wind-farm-deal-assures-bigger-u-s-role/,274,Business Day,2010-08-09T06:04:03+0000,Business,Wind Farm Deal Assures Bigger U.S. Role,The United Steelworkers and two Chinese companies announced Friday that they had signed an agreement assuring that major components of machines for a $1.5 billion wind farm in Texas would be made in the United States.
nyt://article/07a69508-c531-577a-94eb-c5f5c9e81adb,https://mediadecoder.blogs.nytimes.com/2010/09/28/pelosi-to-zucker-democrats-will-prevail/,650,Business Day,2010-09-28T16:12:46+0000,,Pelosi to Zucker: Democrats Will Prevail,Jeff Zucker interviewed House Speaker Nancy Pelosi at the start of a breakfast sponsored by the women and lifestyle entertainment networks unit of NBC Universal.
nyt://article/bd961c1c-5e15-5e07-9182-74eaa40e79b1,https://dealbook.nytimes.com/2010/09/13/follow-the-dirty-money/,166,Business Day,2010-09-13T11:31:48+0000,Business,Follow the Dirty Money,An elite multi-agency task force is needed to monitor banks closely enough to root out international money laundering.
nyt://article/ca989537-0cb4-5f80-a8a3-787dae88a771,https://dealbook.nytimes.com/2010/08/26/food-based-social-network-gets-funding/,104,Business Day,2010-08-26T06:31:13+0000,Business,Food-Based Social Network Gets Funding,"Foodspotting, a start-up that allows users to share photos of their favorite dishes with friends and other food-lovers, has landed a $750,000 seed round from a series of angel investors."
nyt://article/1a9f875f-eec0-5a91-93d9-acdf17038f69,https://economix.blogs.nytimes.com/2010/08/19/no-double-dip-on-the-rails/,219,Business Day,2010-08-19T19:55:17+0000,Business,No Double Dip on the Rails,Rail shipments seem to indicate the economy is still growing at a decent rate.
nyt://article/94838021-3f42-5ceb-9cfb-a83edae4e843,https://dealbook.nytimes.com/2010/07/22/paulson-company-to-go-retail-report-says/,145,Business Day,2010-07-22T08:44:48+0000,Business,"Paulson & Company to Go Retail, Report Says","Paulson & Company, the hedge fund linked to civil fraud charges against Goldman Sachs, will begin a new fund open to retail investors, the Financial Times reported."
nyt://article/4c6c5174-aa9e-52f2-bd6d-269b9abd818d,https://dealbook.nytimes.com/2010/07/23/antidepressant-maker-taps-24-million/,74,Business Day,2010-07-23T11:37:44+0000,Business,Antidepressant Maker Taps $24 Million,"A group of investors seem quite cheered by Euthymics Bioscience’s prospects, ponying up $24 million in a first round of funding for the developer of next-generation antidepressants."
nyt://article/59e4d91d-cec3-552b-a4ec-0b181b24cfd6,https://rendezvous.blogs.nytimes.com/2010/09/12/alonso-leads-ferrari-to-a-home-race-victory/,167,World,2010-09-12T13:43:51+0000,,Alonso Leads Ferrari to a Home Race Victory,"Fernando Alonso drove his Ferrari to a dramatic victory at his Ferrari team’s home race in Monza, Italy. After losing the lead on the first lap, he regained it with 15 laps left."
nyt://article/731e0858-f126-5a2d-b940-5c4e9ed00953,https://dealbook.nytimes.com/2010/09/27/hedge-funds-are-reaping-the-rewards-of-regulation/,193,Business Day,2010-09-27T10:15:16+0000,Business,Hedge Funds Are Reaping the Rewards of Regulation,"Hedge fund operators don’t have much to complain about, Reuters Breakingviews says. Though private equity and hedge funds haven’t entirely escaped tighter controls, the regulatory spotlight on banks is making talent more readily available."
nyt://article/7b31ce2e-fc48-54ce-a933-5c39bba3b9b9,https://dealbook.nytimes.com/2010/07/27/deutsche-bank-posts-1-5-billion-profit/,274,Business Day,2010-07-27T06:26:53+0000,Business,Deutsche Bank Posts $1.5 Billion Profit,"Deutsche Bank said Tuesday that it had earned a profit of 1.2 billion euros in the second quarter, down from 1.1 billion euros for the same period last year, though a number of its business units saw profits slide."
nyt://article/ef9f386d-d8d9-5c8d-b988-960c0f125b3f,https://dealbook.nytimes.com/2010/07/19/axa-nab-extend-11-5-billion-takeover-deal/,164,Business Day,2010-07-19T07:06:32+0000,Business,AXA-NAB Extend $11.5 Billion Takeover Deal,"National Australia Bank, the takeover target AXA Asia Pacific and France’s AXA SA agreed to extend an $11.5 billion acquisition agreement to Aug 31, signaling they were far from resolving regulatory obstacles, Reuters reported."
nyt://article/8c21388a-65ea-5c94-92ab-5c91399726c1,https://gadgetwise.blogs.nytimes.com/2010/09/17/an-ipod-speaker-dock-goes-vertical/,390,Technology,2010-09-17T10:47:56+0000,,An iPod Speaker Dock Goes Vertical,Audyssey has launched a high-end iPod speaker dock that doubles as a PC speaker and a speakerphone.
nyt://article/499b361c-3204-588b-8d2f-af6bd60415cd,https://dealbook.nytimes.com/2010/07/13/guessing-at-hefners-playboy-bid/,762,Business Day,2010-07-13T09:06:47+0000,Business,Guessing at Hefner’s Playboy Bid,"Hugh Hefner’s bid Monday to take Playboy Enterprises private was as mysterious as it was surprising, leaving guessing about the mogul’s motives."
nyt://article/b0b782b2-ff14-5241-831c-8a93be8be31e,https://mediadecoder.blogs.nytimes.com/2010/07/14/speed-read-for-wednesday-july-14/,44,Business Day,2010-07-14T11:56:56+0000,Media,"Speed Read for Wednesday, July 14",In Wednesday’s media news: Piers Morgan closes in on Larry King’s job.
