_id,url,word_count,section,date,type,headline,abstract
nyt://article/bbbbe8bd-b4a8-552b-b2bc-10ec4c33f9ef,https://dealbook.nytimes.com/2010/09/16/chinese-u-s-steel-deal-moves-forward/,174,Business Day,2010-09-16T09:48:07+0000,Business,Chinese-U.S. Steel Deal Moves Forward,"Anshan Iron and Steel is moving ahead with its plans to take a stake in Steel Development, despite concerns by some U.S. lawmakers about the Chinese investment in the American steel industry"
nyt://article/76c0ff71-5bb7-5927-8bda-49ed1952e5ec,https://atwar.blogs.nytimes.com/2010/09/02/iraqi-military-adjusts-to-u-s-support-minus-combat-troops/,1524,World,2010-09-03T03:43:57+0000,Foreign,Analysis: Iraq’s Military Needs After 2011,"The third phase, from the end of 2016 to the end of 2020, is the “completion phase” by which time the Iraqi army will be a “real power,” able to deal not only with internal, but also external threats."
nyt://article/66b04369-91dc-5f65-be14-f2539c516f44,https://dealbook.nytimes.com/2010/08/19/och-ziff-says-s-e-c-inquiry-went-nowhere/,133,Business Day,2010-08-19T06:38:44+0000,Business,Och-Ziff Says S.E.C. Inquiry Went Nowhere,"Och-Ziff Capital Management Group was a subject of a regulatory probe surrounding Lehman Brothers’ 2008 collapse but the investigation went “nowhere,” a lawyer for the fund company said on Wednesday."
nyt://article/e2d1f259-3870-56a3-aaef-60242747b9b2,https://atwar.blogs.nytimes.com/2010/09/01/an-iraqi-womans-change-of-address-and-new-life/,730,World,2010-09-01T19:42:36+0000,Foreign,An Iraqi Woman’s Change of Address and New Life,"Almost nine months ago, Anwar and her family came to the United States, taking part in a special visa program for Iraqis who risked their lives to help Americans in wartime."
nyt://article/32cf13ef-191d-58c1-813a-0211afdc0bef,https://bucks.blogs.nytimes.com/2010/08/20/friday-reading-open-house-horror-stories/,130,Your Money,2010-08-20T14:23:32+0000,,Friday Reading: Open House Horror Stories,"Readers share their open-house horror stories, the status of the foreclosure problem and other consumer-focused items from Friday’s Times."
nyt://article/b0945481-b014-5b05-9d01-f5d0d22c68cd,https://dealbook.nytimes.com/2010/09/10/deutsche-poised-for-11-4-billion-share-issue/,256,Business Day,2010-09-10T10:39:31+0000,Business,Deutsche Poised for $11.4 Billion Share Issue,"Deutsche Bank, the largest German lender, is set to announce a share issue of up to 9 billion euros as it prepares for more stringent banking regulations and seeks to acquire a larger stake in Postbank, a person with direct knowledge of the matter told DealBook."
nyt://article/dee7ba08-ccfc-51ef-8a0a-331fa4ede665,https://gadgetwise.blogs.nytimes.com/2010/08/08/tip-of-the-week-eating-lunch-and-surfing-on-the-web/,121,Technology,2010-08-08T11:10:14+0000,,Tip of the Week: Eating Lunch and Surfing on the Web,Eating lunch and catching up on the news may be more pleasant with the ScrollyFox add-on for Mozilla Firefox.
nyt://article/7158bc94-c3b9-52ba-9d11-10380f790cb2,https://dealbook.nytimes.com/2010/07/23/cuban-rushes-as-judge-sets-rangers-auction-date/,264,Business Day,2010-07-23T11:03:50+0000,Business,Cuban Rushes as Judge Sets Rangers Auction Date,The Texas Rangers’ auction is on — and it looks like Mark Cuban may be there with his paddle raised.
nyt://article/8e1ac249-e450-53f2-b92f-0319dd9d4586,https://dealbook.nytimes.com/2010/09/17/as-tarp-expires-a-look-at-its-flaws-and-success/,1438,Business Day,2010-09-17T19:26:09+0000,Business,"As TARP Fades, a Look at Its Flaws and Its Success",The Deal Professor examines the Congressional Oversight Panel’s report on TARP and argues that it understates the success of the $700 billion bailout program.
nyt://article/d5c748e7-86aa-5804-958d-95450d41ddfe,https://dealbook.nytimes.com/2010/08/27/omnitrol-nabs-1-4-million-for-analysis-software/,79,Business Day,2010-08-27T06:16:38+0000,Business,Omnitrol Nabs $1.4 Million for Analysis Software,"Omnitrol Networks, a maker of supply chain analysis software, indicated in an S.E.C. filing that it had raised more than half of an expected $2.5 million in financing."
nyt://article/86de1a8a-8a80-59fd-9834-fb5d0d9f19bd,https://dealbook.nytimes.com/2010/08/18/londons-city-watchdog-serious-about-organized-crime/,199,Business Day,2010-08-18T09:27:01+0000,Business,Britain’s F.S.A. Turns Focus to Organized Crime,The Financial Services Authority is ramping up its collaborative efforts with the Serious Organized Crime Agency in an attempt to investigate evidence of a new focus of criminal groups believed to be increasingly involved in financial frauds.
nyt://article/3a168623-f7a2-5a0e-8670-04c73f5c95fe,https://dealbook.nytimes.com/2010/07/26/norris-in-downturn-some-eked-out-millions/,671,Business Day,2010-07-26T05:32:39+0000,Business,"Norris: In Downturn, Some Eked Out Millions","Despite all the negative news in 2008, there were still 13,480 tax returns showing income of more than $10 million."
nyt://article/87abe6d6-6a59-5f8c-9b7b-e8a9989cbf11,https://dealbook.nytimes.com/2010/08/17/morning-take-out-67/,151,Business Day,2010-08-17T12:14:54+0000,Business,Morning Take-Out,More purported fraud at for-profit colleges; speculation that the Lehman Brothers case is heating up; what real inflation looks like.
nyt://article/b64aae58-54ee-59b4-a759-07bb7c5b9339,https://dealbook.nytimes.com/2010/09/30/providence-to-sell-stake-in-german-cable-company/,71,Business Day,2010-09-30T11:36:24+0000,Business,Providence to Sell Stake in German Cable Company,"Providence Equity Partners is selling a big chunk of its majority holding in Germany’s Kabel Deutschland, in a deal worth around $573 million."
nyt://article/e6dba63c-e8e2-55ae-abbe-6f5d4f2abf9c,https://dealbook.nytimes.com/2010/09/07/macquarie-profit-warning-signals-wider-malaise/,295,Business Day,2010-09-07T09:25:22+0000,Business,Macquarie Profit Warning Signals Wider Malaise,"Macquarie Group, the Australian investment bank, warned Monday that profit in a number of its deal-making and trading divisions would be down by a quarter compared to the year before."
nyt://article/9156bea2-6bee-565c-aee8-2ef84e301bb6,https://dealbook.nytimes.com/2010/09/29/private-equity-thrives-again-but-dark-shadows-loom/,1194,Business Day,2010-09-30T03:10:58+0000,Business,"Private Equity Thrives Again, but Dark Shadows Loom","Buyout deals are picking up steam, but the large public pension funds that provide private equity with more than half its capital are wary of some complex deals."
nyt://article/6589b82f-0e00-5810-b616-f2eca9e243b0,https://dealbook.nytimes.com/2010/08/16/china-consortium-may-bid-for-30-percent-of-aia/,144,Business Day,2010-08-16T09:30:06+0000,Business,Chinese Consortium May Bid for 30 Percent of AIA,"A consortium of leading Chinese companies including Industrial and Commercial Bank of China and China Life Insurance, plans to bid for a 30 percent stake in American International Group Asian life insurance business, AIA, the 21st Century Business Herald reported."
nyt://article/0c4874c5-27f6-59dd-a367-f71067bff639,https://dealbook.nytimes.com/2010/09/29/wall-streets-layoff-problem-is-spreading/,211,Business Day,2010-09-29T12:58:35+0000,Business,Wall Street’s Layoff Problem Is Spreading,"With D.E. Shaw & Company laying off 10 percent of its workforce, Wall Street is finding that its recent troubles haven’t gone away."
nyt://article/5eaf4e1c-b62a-5e7d-9ebb-3de9332865c0,https://economix.blogs.nytimes.com/2010/08/03/more-on-work-and-parenthood/,365,Business Day,2010-08-04T01:47:22+0000,Business,More on Work and Parenthood,Are more mothers dropping out of the labor force? How quickly does the pay of male and female business-school graduates diverge? What did the health reform bill have to say about nursing on the job?
nyt://article/de695d37-4a79-5bd6-a8b9-176524022231,https://dealbook.nytimes.com/2010/08/27/pershing-square-betting-against-bps-debt/,131,Business Day,2010-08-27T10:43:02+0000,Business,Pershing Square Betting Against BP’s Debt,"William Ackman’s Pershing Square Capital Management is betting against the debt of BP through credit-default swaps, saying the energy company’s creditworthiness will be dented for years after its notorious oil spill."
nyt://article/c04deda5-dd15-5bcc-acde-e9ee74280c1a,https://bucks.blogs.nytimes.com/2010/09/22/the-credit-card-formerly-known-as-schwab/,735,Your Money,2010-09-22T16:00:54+0000,,The Credit Card Formerly Known as Schwab,"Schwab is leaving the card business, endangering its 2 percent cash-back credit card."
nyt://article/475d9435-c9f8-5eca-8ca1-616f2d5495f9,https://gadgetwise.blogs.nytimes.com/2010/07/27/apple-brings-magic-multitouch-to-the-computer/,309,Technology,2010-07-27T17:33:18+0000,,Apple Brings (Magic) Multitouch to the Computer,"The company added another device to its multitouch arsenal on Tuesday with the Magic Trackpad, a mouse replacement for desktop computers."
nyt://article/0256fd60-9ca5-5614-8428-a6462c1851e7,https://dealbook.nytimes.com/2010/07/09/stocks-regain-momentum-late-in-the-day/,673,Business Day,2010-07-09T09:44:16+0000,Business,Stocks Regain Momentum Late in the Day,"The latest weekly jobs report on Thursday propelled stocks for the third day this week, building on gains that analysts hope will be sustained after corporate earnings season begins."
nyt://article/f4924143-3c97-57f9-98bd-fdcc1e232954,https://dealbook.nytimes.com/2010/08/06/barclays-defends-universal-model-against-breakup/,146,Business Day,2010-08-06T09:12:17+0000,Business,Barclays Defends Universal Model Against Breakup,"Barclays delivered a thinly veiled threat to the British government on Thursday, warning that a break-up could force it to move abroad. The Financial Times reported that the warning came as the bank defended its approach of combining retail and investment banking under one roof."
nyt://article/5cbc0da6-892c-5e8b-a7e1-d100b0ac46df,https://gadgetwise.blogs.nytimes.com/2010/09/24/qa-tip-of-the-week-easy-listening/,112,Technology,2010-09-24T11:47:59+0000,,Q&A Tip of the Week: Easy Listening,How to sample more than one song in an online music store in one click.
nyt://article/ead62dc2-401a-5827-89e4-30560c64bcf2,https://dealbook.nytimes.com/2010/07/16/smart-technologies-prices-biggest-i-p-o-of-2010/,202,Business Day,2010-07-16T09:39:16+0000,Business,Smart Technologies Prices Biggest I.P.O. of 2010,"Whiteboard maker Smart Technologies raised $660.1 million in the biggest initial public offering listing in the United States this year, The Associated Press reported."
nyt://article/a52671b3-8b9f-5993-aa75-158f692477c3,https://boss.blogs.nytimes.com/2010/07/20/explaining-the-changing-face-of-s-b-a-borrowers/,1267,Business Day,2010-07-20T11:00:27+0000,Business,Explaining the Changing Face of S.B.A. Borrowers,The second Bush administration viewed a program that looked at borrowers by race or gender as constitutionally suspect.
nyt://article/cdb3b6a5-2280-50d9-a8b9-8d0c69675c7d,https://dealbook.nytimes.com/2010/07/14/e-u-s-test-results-expected-soon-but-details-may-lag/,721,Business Day,2010-07-14T05:35:11+0000,Business,"E.U.’s Test Results Expected Soon, but Details May Lag",Top European finance officials said Tuesday that results of banking stress tests would be released on July 23 but that some national regulators could take longer to release more detailed information on certain lenders.
nyt://article/ff6c3261-f2cf-5ded-83b4-fafa60435633,https://bucks.blogs.nytimes.com/2010/07/29/what-the-financial-overhaul-means-for-renters/,471,Your Money,2010-07-29T19:47:12+0000,,What the Financial Overhaul Means for Renters,"The financial overhaul bill extends the end date of a law providing more protection for renters in foreclosed properties, and it also clarifies who the protections apply to."
nyt://article/b41c88e8-7803-5dfc-b287-09886ad67323,https://dealbook.nytimes.com/2010/09/30/deal-makers-cautious-despite-uptick-in-m-a/,607,Business Day,2010-09-30T16:41:52+0000,Business,Deal Makers Cautious Despite Uptick in M.&A.,Uncertainty over the direction of the economy continues to weigh on mergers and acquisitions.
nyt://article/adfef24a-c3fe-54f6-ac26-05610ddbbdc7,https://dealbook.nytimes.com/2010/08/27/foreclosures-fall-but-early-delinquencies-rise/,216,Business Day,2010-08-27T06:30:56+0000,Business,"Foreclosures Fall, but Early Delinquencies Rise","Foreclosures could head higher in coming months, as the percentage of borrowers at least one payment behind resumed its rise, new data suggest."
nyt://article/c4d05329-3d93-569c-aa3e-3d01d18add05,https://dealbook.nytimes.com/2010/08/16/norris-rates-fall-on-fears-of-weak-economy/,254,Business Day,2010-08-16T10:19:43+0000,Business,Norris: Rates Fall on Fears of Weak Economy,"As governments try to bring down deficits, investors seem more concerned by the possibility of renewed recession, Floyd Norris writes in The New York Times."
nyt://article/853798b0-3374-550f-ac7e-2d9a84b11957,https://dealbook.nytimes.com/2010/08/10/saying-recovery-has-slowed-fed-to-buy-u-s-debt/,944,Business Day,2010-08-10T18:19:22+0000,Business,"Fed to Buy U.S. Debt, Saying Recovery Has Slowed","The Federal Reserve acknowledged that its confidence in the economic recovery had dimmed, and it said it would use the proceeds from its huge mortgage-bond portfolio to buy long-term Treasury securities."
nyt://article/f46f7349-79a2-54c5-881c-fd7d48576f37,https://dealbook.nytimes.com/2010/09/29/bank-of-america-cuts-back-its-prop-trading-desk/,271,Business Day,2010-09-29T21:56:27+0000,Business,Bank of America Cuts Back Its Prop Trading Desk,"Bank of America Merrill Lynch is laying off 20 to 30 proprietary traders, or roughly a third of its team, as it aims to comply with the Volcker Rule that restrict banks from making bets with their own money."
nyt://article/cfaf2442-ef4c-500e-a823-2c4378b62d9f,https://dealbook.nytimes.com/2010/07/16/bank-of-americas-chief-sounds-cautious-note/,458,Business Day,2010-07-16T13:24:31+0000,Business,Bank of America’s Chief Sounds Cautious Note,"While Bank of America’s chief executive struck an upbeat tone on Friday, he cautioned that some elements in the economy may continue to negatively affect the firm."
nyt://article/e87e21ad-f0a2-575f-b76d-9e2c8ce323c8,https://bits.blogs.nytimes.com/2010/08/12/inside-the-net-neutrality-debate/,469,Technology,2010-08-12T17:19:15+0000,Business,More on the Net Neutrality Debate,A round-up of some of the discussions taking place this week about net neutrality and the future of the Internet.
nyt://article/27c1d9ac-177f-59e5-9c31-68820462acfb,https://bits.blogs.nytimes.com/2010/08/31/digg-hires-new-ceo-amid-site-changes/,302,Technology,2010-08-31T22:33:25+0000,Business,Digg Hires New C.E.O. Amid Site Changes,"Amid user turmoil over a recent redesign, the Web site Digg.com appointed a new chief executive on Tuesday."
nyt://article/4ae8b182-b97d-5bb3-88d3-e18d406aad44,https://dealbook.nytimes.com/2010/07/26/tesla-electric-cars-revved-up-but-far-to-go/,783,Business Day,2010-07-26T09:12:26+0000,Business,"Tesla Electric Cars: Revved Up, but Far to Go","For Elon Musk, the chief executive of Tesla Motors, building the car company has been yet another chapter in an entrepreneurial odyssey that is as emblematic of how reputations are made and undone in Silicon Valley as it is of Mr. Musk’s own strengths and weaknesses."
nyt://article/c5b5c8eb-21b6-568e-b6f1-be83663770df,https://mediadecoder.blogs.nytimes.com/2010/07/05/larry-king-dreams-a-little/,317,Business Day,2010-07-05T04:10:07+0000,Media,Larry King Dreams a Little,"He made an on-the-air offer to the MLB Network to become its West Coast anchor. But he might also do stand-up, or promote a bagel company."
nyt://article/2da622ae-b129-589c-9257-5cc06030fad5,https://dealbook.nytimes.com/2010/07/15/europe-clears-trans-atlantic-air-alliance/,304,Business Day,2010-07-15T06:41:18+0000,Business,Europe Clears Trans-Atlantic Air Alliance,"British Airways, American Airlines and Iberia won European Union antitrust clearance on Wednesday to deepen their Oneworld alliance on trans-Atlantic routes and better compete with rival groups, Reuters reported."
nyt://article/c7ff23be-e5fb-5d83-b026-fc82e585bdf7,https://dealbook.nytimes.com/2010/09/08/hellman-friedman-to-buy-associated-materials/,138,Business Day,2010-09-08T15:31:20+0000,Business,Hellman & Friedman to Buy Associated Materials,"The deal is the latest so-called secondary buyout, or a deal struck between buyout firms, as private equity players seek to exit from their holdings."
nyt://article/6e8f0610-3b5f-5c4b-ae8e-c56d30d06b90,https://dealbook.nytimes.com/2010/08/30/morgenson-its-not-over-until-its-in-the-rules/,304,Business Day,2010-08-30T06:03:51+0000,Business,Morgenson: It’s Not Over Until It’s in the Rules,"During the rules-writing process for the financial overhaul, regulators will have to withstand pressure from big banks that want to keep control over the derivatives market."
nyt://article/b59a1247-ff48-5376-9182-66fba5ebfeb8,https://bucks.blogs.nytimes.com/2010/07/27/using-pretax-money-to-cover-concierge-practice-fees/,699,Your Money,2010-07-27T16:03:22+0000,,Using Pretax Money to Cover Concierge Practice Fees,"As the concierge model spreads among doctors, here’s the scoop on whether you can pay the membership fee with pretax money from flexible spending accounts and health saving accounts."
nyt://article/ec08ca46-6905-562b-a1c3-2b490f66f3b3,https://economix.blogs.nytimes.com/2010/09/17/window-dressing-24-7/,437,Business Day,2010-09-17T15:20:30+0000,Business,"Window Dressing, 24-7?",The S.E.C. tries to make it harder for the next Lehman to hide just how deeply in debt it is. Will it work?
nyt://article/3a8e673e-79a3-5f64-a4bd-9100ee5e8690,https://dealbook.nytimes.com/2010/07/21/google-investors-back-jive-software-for-30-million/,78,Business Day,2010-07-21T07:58:14+0000,Business,Google Investors Back Jive Software for $30 Million,"Kleiner Perkins Caufield & Byers and Sequoia Capital, the venture firms that made billions of dollars backing Google, are investing $30 million in Jive Software, a maker of social-networking technology for businesses, Bloomberg News reported."
nyt://article/5ab7085c-3207-519e-8e57-e833841e9c31,https://bucks.blogs.nytimes.com/2010/08/19/the-challenge-of-estimating-closing-costs-for-a-home/,422,Your Money,2010-08-19T20:57:09+0000,,The Challenge of Estimating Closing Costs for a Home,"The national average Good Faith Estimate of closing costs is nearly 40 percent higher than last year, according to Bankrate.com. Does that figure tell the whole story?"
nyt://article/0781f21e-b53f-54dc-ab14-170169f8a9f4,https://mediadecoder.blogs.nytimes.com/2010/09/10/pentagon-loosens-restrictions-for-press-in-guantnamo/,410,Business Day,2010-09-10T17:47:56+0000,,Pentagon Loosens Restrictions for Press in Guantánamo,"After months of wrangling between media organizations and the Pentagon, the military has agreed to revise some of its guidelines that limited what journalists could report and document from Guantanamo Bay."
nyt://article/43a8c12b-e342-5f25-9006-7e8a7f19239c,https://dealbook.nytimes.com/2010/07/09/mdc-again-combines-two-agencies/,122,Business Day,2010-07-09T10:10:02+0000,Business,MDC Again Combines Two Agencies,"MDC Partners, the Toronto-based agency holding company that has made a name for itself with several spates of acquisitions, said on Thursday that it would combine Zig, an agency based in Toronto, with Crispin Porter & Bogusky."
nyt://article/71fea55e-6852-5587-9db3-cc3be0c61119,https://dealbook.nytimes.com/2010/07/14/grassley-to-vote-against-financial-overhaul/,133,Business Day,2010-07-14T20:18:28+0000,Business,Grassley to Vote Against Financial Overhaul,"Senator Charles E. Grassley, the Iowa Republican who voted for an earlier version of the financial regulatory bill, plans to vote no this time around."
nyt://article/3e32cc16-8765-59d5-ada9-3573d11e96ee,https://bits.blogs.nytimes.com/2010/08/17/the-class-of-2014-no-e-mail-or-wristwatches/,276,Technology,2010-08-17T17:34:21+0000,Business,"For the Class of 2014, No E-Mail or Wristwatches",The Beloit College Mindset List helps prepare professors for the incoming class’s cultural habits.
nyt://article/0ccc7cf0-d431-54ce-9ef9-8f73c4fddcfc,https://dealbook.nytimes.com/2010/08/12/barnes-noble-settlement-talks-collapse/,299,Business Day,2010-08-12T16:48:47+0000,Business,Barnes & Noble Settlement Talks Collapse,Talks between Barnes & Noble and the billionaire investor Ronald W. Burkle to avert a fight over the bookseller’s board have fallen apart.
nyt://article/159b1dde-a29b-5695-ae3f-01d02c274450,https://dealbook.nytimes.com/2010/08/03/relational-and-calstrs-letter-to-occidental/,111,Business Day,2010-08-03T17:07:36+0000,Business,Relational and Calstrs’ Letter to Occidental,"Read the letter from Relational Investors and Calstrs to Occidental Petroleum’s board, warning them of an impending proxy fight."
nyt://article/3c1f31d0-4e88-5cf8-a447-921b0285b4cf,https://dealbook.nytimes.com/2010/08/27/i-r-s-to-drop-suit-against-ubs-over-tax-havens/,221,Business Day,2010-08-27T06:42:27+0000,Business,I.R.S. to Drop Suit Against UBS Over Tax Havens,The Internal Revenue Service said Thursday that it would drop a closely watched civil lawsuit against the Swiss bank giant UBS after the Swiss government said it was on course to hand over details on thousands of American clients suspected of using their accounts to evade taxes.
nyt://article/cfe92d7f-90c6-5252-a367-089417a47bee,https://gadgetwise.blogs.nytimes.com/2010/09/30/an-ipod-dock-that-shuffles-a-duo-of-devices/,325,Technology,2010-09-30T21:39:12+0000,,An iPod Dock That Shuffles a Duo of Devices,An Altec Lansing iPod dock shuffles between two iPods as they shuffle.
nyt://article/5ff387a5-2249-5a9a-9e67-fdac9b5e9818,https://bucks.blogs.nytimes.com/2010/08/18/how-mutual-fund-managers-are-like-cigarette-makers/,445,Your Money,2010-08-18T16:39:47+0000,,How Mutual Fund Managers Are Like Cigarette Makers,Excerpts from an e-mail in which the founders of MarketRiders equate mutual fund managers to tobacco pushers.
nyt://article/eda96d73-02cd-560a-930a-e1c531b65acd,https://mediadecoder.blogs.nytimes.com/2010/09/30/boston-globe-to-start-a-paid-web-site/,466,Business Day,2010-09-30T16:57:11+0000,,Boston Globe to Start a Paid Web Site,"The Boston Globe, part of The New York Times Company, announced on Thursday that it would start a new paid Web site in the second half of 2011."
nyt://article/207f2969-000d-5cd5-b73d-4cf7fa20bc93,https://boss.blogs.nytimes.com/2010/08/24/here-are-my-three-problems-this-week/,667,Business Day,2010-08-24T11:00:28+0000,Business,Here Are My Three Problems This Week,"On hiring the right person, paying the right wages, and managing sales people."
nyt://article/bfccf890-62f2-5f49-ab1a-aba8444ba77d,https://bits.blogs.nytimes.com/2010/07/19/apple-iphone-4-press-conference-fallout/,386,Technology,2010-07-19T19:14:00+0000,Business,Fallout From the iPhone 4 Press Conference,An Apple press conference that was meant to ease concerns over the iPhone 4’s antenna problems set off more debate.
nyt://article/da291aa2-c4ae-556b-9afd-8e3aae950fc5,https://economix.blogs.nytimes.com/2010/08/02/the-financial-earthquake-finding-a-new-economics-in-the-rubble/,637,Business Day,2010-08-02T19:39:44+0000,Business,The Financial Earthquake: Finding a New Economics in the Rubble,Calling the recent financial crisis an “earthquake” may be a more apropos nickname than many people realize.
nyt://article/f6bf2f10-e97c-5ebe-8f40-386917d59fde,https://dealbook.nytimes.com/2010/08/16/buyback-window-opened-by-dodd-frank/,144,Business Day,2010-08-16T09:57:45+0000,Business,Buyback Window Opened by Dodd-Frank,"A 90-day securities buyback window has been opened by the new financial reform bill. This will allow banks to buy back $118 billion in high-cost securites and to replace the instruments with cheaper capital, The Financial Times reported."
nyt://article/3a1400bb-8087-566c-9828-6f1a174b4cad,https://dealbook.nytimes.com/2010/08/26/santander-suspends-analyst-charged-by-s-e-c/,356,Business Day,2010-08-26T08:22:38+0000,Business,Santander Suspends Analyst Charged by S.E.C.,Grupo Santander said Wednesday that it had suspended the bank employee charged by the Securities and Exchange Commission with trading on insider information about BHP Billiton’s $39 billion bid for Potash Corp.
nyt://article/4ea933b5-37f1-550c-84e8-7c6c29b8e1b1,https://dealbook.nytimes.com/2010/08/20/k-n-o-c-makes-2-9-billion-bid-for-dana/,182,Business Day,2010-08-20T06:57:41+0000,Business,K.N.O.C. Makes $2.9 Billion Bid for Dana,"Korea National Oil Corp. made its hostile bid for Dana Petroleum public on Friday, offering £1.87 billion cash to the holders of Dana shares and convertible bonds."
nyt://article/bd51bc26-5496-5ddc-92a7-91426ae6a822,https://pogue.blogs.nytimes.com/2010/07/15/at-snopes-com-rumors-are-held-up-to-the-light/,1643,Technology,2010-07-15T18:17:44+0000,,"At Snopes.com, Rumors Are Held Up to the Light","David Pogue interviews David Mikkelson of Snopes.com, where Internet veterans go to get the truth about online rumors."
nyt://article/2d8a360a-5f06-5f35-bccb-71b8c68c8331,https://dealbook.nytimes.com/2010/08/09/a-push-for-bonds-as-shares-fall/,152,Business Day,2010-08-09T04:12:05+0000,Business,A Push for Bonds as Shares Fall,"The bond market in the United States rallied on Friday and stocks retreated after a snapshot of the national job market came in weaker than expected, stoking concerns about the economy."
