_id,url,word_count,section,date,type,headline,abstract
nyt://article/10fc52fd-de9d-59f1-bdae-5144803f24c3,https://www.nytimes.com/2010/07/30/world/middleeast/30briefs-yemen.html,133,World,2010-07-30T04:05:33+0000,Foreign,Yemen: President Makes Offer to Rebels,President Ali Abdullah Saleh  offered to bring leaders of an armed rebel faction into Yemen’s political process.
nyt://article/dd550a48-ab73-5cdc-a88b-d30e0261d0c6,https://www.nytimes.com/2010/07/22/technology/personaltech/22smart.html,1062,Technology,2010-07-21T20:58:22+0000,Business,"Hitting the Road, With Apps",A three-and-half hour car trip with two youngsters in the back seat seemed like the perfect opportunity to test which gadgets and apps could be of help on the open road. 
nyt://article/db507f70-a659-5a92-837f-77a283ba7477,https://www.nytimes.com/2010/07/28/world/africa/28somalia.html,1024,World,2010-07-28T02:01:02+0000,Foreign,"More Troops for Somalia, but No Peace to Keep",Analysts say sending more peacekeepers to Somalia is the wrong approach because outside forces have been unable to stabilize the country thus far.
nyt://article/e2acf68d-d485-51c4-8973-60b9246cae0d,https://www.nytimes.com/2010/08/21/business/21eggs.html,985,Business Day,2010-08-20T17:51:46+0000,Business,Growing Concern About Tainted Eggs After Recall,Hillandale Farms issued a recall of eggs it sent to 14 states that were linked to a recent salmonella outbreak.
nyt://article/ca14bbe3-92b5-562b-9513-0ff13eb31ac9,https://www.nytimes.com/2010/09/21/business/21views.html,761,Business Day,2010-09-21T00:38:16+0000,Business,Indian Bid for MGM Is a Safe Move for Hollywood,The Indian film producer would not shake things up for Hollywood as a Web-based video company would.
nyt://article/5f1bf67c-cc20-5f66-b3de-c2dc6c959d22,https://www.nytimes.com/2010/07/27/world/middleeast/27iran.html,1070,World,2010-07-26T14:38:52+0000,Foreign,Europe Imposes New Sanctions on Iran,The move by Iran’s largest trading partner adds to the pressure on Tehran over its nuclear program.
nyt://article/8a37bc42-2742-5302-a6ad-294e8365225c,https://www.nytimes.com/2010/09/28/world/americas/28venez.html,872,World,2010-09-27T09:04:46+0000,Foreign,Shift in Venezuelan Politics as Chávez’s Opposition Reclaims Seats in Legislature,The legislative elections offered a view into the viability and direction of President Hugo Chávez’s political movement.
nyt://article/b4eb4ca4-3bad-5c1a-817e-cbff5e345ba1,https://www.nytimes.com/2010/09/30/world/middleeast/30iraq.html,1067,World,2010-09-29T18:40:57+0000,Foreign,Attacks on Baghdad Green Zone Surge,The heavily fortified Green Zone in Iraq’s capital has in recent weeks come under an intensifying barrage of rocket attacks.
nyt://article/4d0758a3-6e38-5e58-869d-e632f1419c33,https://www.nytimes.com/2010/08/23/business/global/23telecom.html,1010,Business Day,2010-08-23T01:39:26+0000,Business,Scrutiny for Chinese Telecom Bid,Eight Republican lawmakers have asked the Obama administration to study Huawei and its bid to supply equipment to Sprint Nextel.
nyt://article/74102994-9522-55a3-abbd-b4b7e2b4765c,https://www.nytimes.com/2010/08/26/world/asia/26kabul.html,1886,World,2010-08-26T01:21:47+0000,Foreign,Karzai Aide in Corruption Inquiry Is Tied to C.I.A.,Officials say an aide to the president of Afghanistan being investigated for corruption is being paid by the C.I.A.
nyt://article/c2bef7f6-9ae0-5163-8c49-775ff56e63b8,https://www.nytimes.com/2010/09/28/world/asia/28drones.html,1060,World,2010-09-28T01:21:12+0000,Foreign,C.I.A. Steps Up Drone Attacks on Taliban in Pakistan,"The C.I.A. has drastically increased bombing in the mountains of Pakistan, American officials said, part of an effort to try to cripple the Taliban there."
nyt://article/f630d2b6-f9a5-55b8-8346-2e8c44afa3a7,https://www.nytimes.com/2010/07/15/technology/personaltech/15smart.html,899,Technology,2010-07-14T22:25:35+0000,Business,"Tracking the Day’s Business News, From Markets to Mergers","Keep track of all the business news, from mergers to markets, with any one of a variety of free business applications for smartphones, the iPod Touch or the iPad."
nyt://article/cbdf0193-90dc-51af-9cb8-417b1e6d9a97,https://www.nytimes.com/2010/09/08/world/asia/08australia.html,555,World,2010-09-07T04:26:11+0000,Foreign,Australian Labor Party to Form New Government,"Two independent lawmakers said they will support Prime Minister Julia Gillard, ending weeks of political impasse."
nyt://article/a1619877-e2de-50d9-82dc-e028b8e72479,https://www.nytimes.com/2010/07/16/world/middleeast/16bazaar.html,544,World,2010-07-15T22:17:48+0000,Foreign,Strike at Bazaar Spreads Beyond Tehran,"A strike at the traditional bazaar in Tehran continued into a second week on Thursday, spreading to at least two other major cities, news Web sites reported."
nyt://article/847cb89b-7c42-5ce6-8474-a5a01ced23ee,https://www.nytimes.com/2010/07/28/business/28markets.html,693,Business Day,2010-07-27T11:54:24+0000,Business,U.S. Markets Mixed as Consumer Confidence Falls,Shares on Wall Street closed mixed Tuesday after reports that consumers had become more pessimistic about the job market and the economic recovery in general.
nyt://article/87cbb559-1a56-504f-a63c-2ce94762f8a0,https://www.nytimes.com/2010/08/05/business/05insider.html,375,Business Day,2010-08-05T00:45:48+0000,Business,Ex-Deloitte Partner and Son Settle Insider Trading Claims,"Thomas Flanagan, a former partner at Deloitte & Touche, and his son Patrick traded on nonpublic information of the auditor’s clients."
nyt://article/0d4748b3-93fd-5088-9984-52dc12b86f17,https://www.nytimes.com/2010/08/17/world/americas/17colombia.html,314,World,2010-08-16T19:19:12+0000,Foreign,Jet Crash on Colombian Island Kills 1,"A jetliner with 131 passengers aboard crashed on the island of San Andrés early Monday, but officials said only one passenger died."
nyt://article/c0060e98-3177-54e0-990b-9b9a191d2a78,https://www.nytimes.com/2010/07/08/business/global/08bp.html,890,Business Day,2010-07-07T22:41:59+0000,Business,BP Tries to Reassure Shareholders,BP’s chief executive has been talking to shareholders to convince them that BP can pay for the Gulf of Mexico oil spill without jeopardizing growth.
nyt://article/4b675652-d8a8-5fa9-850c-84bc8d6d3d8a,https://www.nytimes.com/2010/09/10/world/middleeast/10nuke.html,489,World,2010-09-10T00:18:50+0000,Foreign,Dissidents Claim Iran Is Building a New Enrichment Site,The dissident group showed satellite photographs of an extensive tunnel-digging operation near a military garrison northwest of Tehran.
nyt://article/61e9ccee-4260-55e5-9d66-6204c09c342f,https://www.nytimes.com/2010/09/24/business/24auto.html,919,Business Day,2010-09-24T01:32:08+0000,Business,U.S. Is Said to Rein in G.M. Stock Offering,"In an effort to obtain the highest possible price, the government has told General Motors that its initial public offering will be smaller than expected."
nyt://article/0fbf8036-9d0e-55a8-9434-847381b90aa1,https://www.nytimes.com/2010/07/26/business/media/26carr.html,1140,Business Day,2010-07-26T03:48:33+0000,Business,"Journalists, Provocateurs, Maybe Both","A new activist-journalist churns out information in real time, and the damage is done before anyone has time to check."
nyt://article/7b1b94f1-41be-5429-8df4-7f2c90ae8fee,https://www.nytimes.com/2010/09/16/business/16craigslist.html,769,Business Day,2010-09-15T17:30:17+0000,Business,Craigslist Says It Has Shut Its Section for Sex Ads,"At a House Judiciary Committee hearing, Craigslist also defended its right to post sex-related ads as well as its efforts to fight sex trafficking."
nyt://article/688d38c0-9b2e-5ce6-a772-bc4da29de8d8,https://www.nytimes.com/2010/08/06/world/africa/06kenya.html,987,World,2010-08-05T08:59:46+0000,Foreign,Kenyans Approve New Constitution,"Kenya’s new constitution, written to address a flawed system that has exacerbated ethnic rifts, passed overwhelmingly."
nyt://article/84bad4a2-99e1-5f13-ab53-fa1ab775f2e3,https://www.nytimes.com/2010/09/11/business/global/11auto.html,376,Business Day,2010-09-11T02:58:15+0000,Business,Two French Automakers Start to Repay Government,The carmakers are paying back the government ahead of schedule because the bailout interest rates are rising as the companies’ profits climb.
nyt://article/926bba45-e894-5dcd-be97-681449fd4dec,https://www.nytimes.com/2010/08/16/business/media/16addes.html,333,Business Day,2010-08-15T23:38:09+0000,Business,"Accounts, People and Miscellany","Account assignments, executive changes and other developments among advertising agencies."
nyt://article/0c22034c-28ac-5ecd-84de-2f0035df8f9c,https://www.nytimes.com/2010/09/13/world/middleeast/13iraq.html,503,World,2010-09-12T22:20:00+0000,Foreign,More Post-Combat U.S. Gunfire in Iraq,American military units fired on insurgents while supporting Iraqi troops northeast of the capital.
nyt://article/d0baeb2f-84bd-5a79-beba-777fb90bf713,https://www.nytimes.com/2010/08/06/world/asia/06pstan.html,692,World,2010-08-05T07:18:02+0000,Foreign,Continuing Rain Slows Flood Aid in Pakistan,"Rain was forecast to continue through the week, slowing aid and rescue efforts in northern and central Pakistan, where hundreds have died."
nyt://article/4da759c4-21e1-53c9-8ceb-788e52d381f5,https://www.nytimes.com/2010/09/04/world/asia/04driver.html,1260,World,2010-09-03T17:48:35+0000,Foreign,"At First She Didn’t Succeed, but She Tried and Tried Again (960 Times)","Cha Sa-soon, 69, has become a national symbol for perseverance in South Korea  and she can legally hit the road."
nyt://article/6f145d9e-5a81-5b27-90a0-55fca394568d,https://www.nytimes.com/2010/07/27/business/27dudley.html,1334,Business Day,2010-07-26T17:21:33+0000,Business,Road to New Confidence at BP Runs Through U.S.,The expected choice of Robert Dudley as BP’s next chief executive shows a recognition that the spill will be a top concern for some time.
nyt://article/c7016d4d-be1c-5820-8126-472e8780d9db,https://www.nytimes.com/2010/09/14/world/middleeast/14mideast.html,686,World,2010-09-13T15:56:44+0000,Foreign,Clinton Calls Settlement Deal Possible,"On her way to Egypt, where Israeli-Palestinian peace talks will resume, Secretary of State Hillary Rodham Clinton struck an optimistic tone."
nyt://article/1896a6b1-9f88-555e-addb-118aaa78b8f0,https://www.nytimes.com/2010/08/10/world/asia/10gyantse.html,1049,World,2010-08-10T00:45:27+0000,Foreign,China Seizes on a Dark Chapter for Tibet,The government has appropriated a British invasion in 1904 as part of the long history of imperialist efforts to dismantle China.
nyt://article/8dad8274-8979-5bd9-b75b-4ba8dddcc9ae,https://www.nytimes.com/2010/09/16/business/16sec.html,696,Business Day,2010-09-15T23:39:55+0000,Business,S.E.C. Defends Exemptions in New Law,Some lawmakers want to repeal a provision in the Dodd-Frank law that exempts the agency from certain disclosures.
nyt://article/479d1054-adea-502a-b062-fec6668a4c19,https://www.nytimes.com/2010/07/06/business/media/06adco.html,919,Business Day,2010-07-05T19:07:14+0000,Business,Product Placement Grows in Music Videos,Record labels are aiming to make videos a revenue source and not just a marketing tool for selling CDs.
nyt://article/7c88c00b-33d2-528b-857d-08cc14bdcb7b,https://www.nytimes.com/2010/08/04/world/africa/04kenya.html,1230,World,2010-08-03T17:42:27+0000,Foreign,Kenya Stakes Reinvention on Constitution Vote,Kenyans are voting on a new constitution that seeks to address a flawed system that has exacerbated ethnic rifts.
nyt://article/632c70d6-e95b-5a0a-8636-4e5317b410c2,https://www.nytimes.com/2010/07/28/world/europe/28blix.html,478,World,2010-07-28T00:03:03+0000,Foreign,Diplomat Harsh on Leaders in Testimony for Iraq Inquiry,"Hans Blix, who led a weapons inspection team in the prelude to the Iraq invasion, testified as part of the British inquiry into the war."
nyt://article/ce5dd60e-0c04-5973-8c83-fcf2343e9f05,https://www.nytimes.com/2010/08/09/technology/09ihome.html,891,Technology,2010-08-09T01:00:30+0000,Business,Docks for Apple Gadgets Help a Business Thrive,"SDI Technologies, an innovator since the 1950s when it made transistor radios, has flourished by making the iHome brand of products."
nyt://article/f1022888-ca98-5be2-a647-c082e07b7694,https://www.nytimes.com/2010/08/05/business/05markets.html,722,Business Day,2010-08-04T12:43:44+0000,Business,A Promising Jobs Report Sends Shares Higher,"Shares were driven by reports that private employers added 42,000 jobs in July and that growth in the services sector was better than expected."
nyt://article/42b375fb-78a8-50a3-aa54-7363b9a2057b,https://www.nytimes.com/2010/07/09/business/economy/09rich.html,1315,Business Day,2010-07-09T00:51:49+0000,Business,Biggest Defaulters on Mortgages Are the Rich,"The well-to-do have stopped paying their home loans in greater numbers, and apparently with less guilt."
nyt://article/c70e0d09-ef1a-5ce7-a51c-eac1d435c12e,https://www.nytimes.com/2010/07/20/business/global/20airshow.html,968,Business Day,2010-07-20T00:38:53+0000,Business,Deals at Air Show Bode Well for Recovery,Boeing and Airbus received orders for more than 180 new planes on the first day of the Farnborough International Airshow.
nyt://article/ae957cef-474e-5572-92a9-8a325bd08ef8,https://www.nytimes.com/2010/09/19/world/americas/19venez.html,1116,World,2010-09-19T00:04:57+0000,Foreign,Left Behind in Venezuela to Piece Lives Together,"Despite the government’s claims of the “end of exclusion,” some indigenous people face a more vexing reality."
nyt://article/97af0596-427e-5eaf-9b39-c28a7a2d05e9,https://www.nytimes.com/2010/08/17/world/americas/17haiti.html,1624,World,2010-08-17T01:45:55+0000,Foreign,Star’s Candidacy in Haiti Puts Focus on Charity,"How Wyclef Jean, the hip-hop star, has guided his charity in Haiti offers one barometer of his ability to lead."
nyt://article/ebfda686-9c1d-5317-8a4d-e49b6e414c04,https://www.nytimes.com/2010/09/28/business/28sorkin.html,937,Business Day,2010-09-28T01:25:45+0000,Business,The Value of a Piece of Facebook,"Facebook shares have recently traded on the secondary market for around $76, giving the company an implied value of $33 billion."
nyt://article/d708c554-4b9e-5da6-a2d1-ceb21ca05a20,https://www.nytimes.com/2010/07/03/technology/03apple.html,836,Technology,2010-07-02T16:27:47+0000,Business,Apple Acknowledges Flaw in iPhone Signal Meter,"In response to complaints, Apple said it would fix the way the signal strength is displayed on the new iPhone. "
nyt://article/0691210b-4141-551c-a075-0420244e49be,https://www.nytimes.com/2010/08/24/world/asia/24cambo.html,1016,World,2010-08-24T01:28:10+0000,Foreign,"In Scarred Land, a Haven for Victims of Acid Burns",Cambodia has a history of acid attacks — a rare and extreme form of revenge or punishment.
nyt://article/cba2fa20-d81b-5c51-82e4-cf082003e72a,https://www.nytimes.com/2010/08/18/world/middleeast/18briefs-EXSOLDIERSPE_BRF.html,155,World,2010-08-18T02:11:22+0000,Foreign,Israel: Ex-Soldier Speaks on Photos,A former Israeli soldier who posted photographs on Facebook of herself posing next to blindfolded Palestinian prisoners said that she did not “understand what’s wrong” with the photographs.
nyt://article/512944aa-b451-531f-9b78-ed7a5f289769,https://www.nytimes.com/2010/09/25/business/25citi.html,674,Business Day,2010-09-25T00:09:52+0000,Business,Citigroup’s Pandit Takes $1 in Compensation for 2010,"Richard D. Parsons, Citigroup’s chairman, said the board would restore Vikram S. Pandit’s compensation to a level comparable to that of other banking chiefs in 2011."
nyt://article/cfe92d7f-90c6-5252-a367-089417a47bee,https://gadgetwise.blogs.nytimes.com/2010/09/30/an-ipod-dock-that-shuffles-a-duo-of-devices/,325,Technology,2010-09-30T21:39:12+0000,,An iPod Dock That Shuffles a Duo of Devices,An Altec Lansing iPod dock shuffles between two iPods as they shuffle.
nyt://article/5ff387a5-2249-5a9a-9e67-fdac9b5e9818,https://bucks.blogs.nytimes.com/2010/08/18/how-mutual-fund-managers-are-like-cigarette-makers/,445,Your Money,2010-08-18T16:39:47+0000,,How Mutual Fund Managers Are Like Cigarette Makers,Excerpts from an e-mail in which the founders of MarketRiders equate mutual fund managers to tobacco pushers.
nyt://article/eda96d73-02cd-560a-930a-e1c531b65acd,https://mediadecoder.blogs.nytimes.com/2010/09/30/boston-globe-to-start-a-paid-web-site/,466,Business Day,2010-09-30T16:57:11+0000,,Boston Globe to Start a Paid Web Site,"The Boston Globe, part of The New York Times Company, announced on Thursday that it would start a new paid Web site in the second half of 2011."
nyt://article/207f2969-000d-5cd5-b73d-4cf7fa20bc93,https://boss.blogs.nytimes.com/2010/08/24/here-are-my-three-problems-this-week/,667,Business Day,2010-08-24T11:00:28+0000,Business,Here Are My Three Problems This Week,"On hiring the right person, paying the right wages, and managing sales people."
nyt://article/bfccf890-62f2-5f49-ab1a-aba8444ba77d,https://bits.blogs.nytimes.com/2010/07/19/apple-iphone-4-press-conference-fallout/,386,Technology,2010-07-19T19:14:00+0000,Business,Fallout From the iPhone 4 Press Conference,An Apple press conference that was meant to ease concerns over the iPhone 4’s antenna problems set off more debate.
nyt://article/da291aa2-c4ae-556b-9afd-8e3aae950fc5,https://economix.blogs.nytimes.com/2010/08/02/the-financial-earthquake-finding-a-new-economics-in-the-rubble/,637,Business Day,2010-08-02T19:39:44+0000,Business,The Financial Earthquake: Finding a New Economics in the Rubble,Calling the recent financial crisis an “earthquake” may be a more apropos nickname than many people realize.
nyt://article/f6bf2f10-e97c-5ebe-8f40-386917d59fde,https://dealbook.nytimes.com/2010/08/16/buyback-window-opened-by-dodd-frank/,144,Business Day,2010-08-16T09:57:45+0000,Business,Buyback Window Opened by Dodd-Frank,"A 90-day securities buyback window has been opened by the new financial reform bill. This will allow banks to buy back $118 billion in high-cost securites and to replace the instruments with cheaper capital, The Financial Times reported."
nyt://article/3a1400bb-8087-566c-9828-6f1a174b4cad,https://dealbook.nytimes.com/2010/08/26/santander-suspends-analyst-charged-by-s-e-c/,356,Business Day,2010-08-26T08:22:38+0000,Business,Santander Suspends Analyst Charged by S.E.C.,Grupo Santander said Wednesday that it had suspended the bank employee charged by the Securities and Exchange Commission with trading on insider information about BHP Billiton’s $39 billion bid for Potash Corp.
nyt://article/4ea933b5-37f1-550c-84e8-7c6c29b8e1b1,https://dealbook.nytimes.com/2010/08/20/k-n-o-c-makes-2-9-billion-bid-for-dana/,182,Business Day,2010-08-20T06:57:41+0000,Business,K.N.O.C. Makes $2.9 Billion Bid for Dana,"Korea National Oil Corp. made its hostile bid for Dana Petroleum public on Friday, offering £1.87 billion cash to the holders of Dana shares and convertible bonds."
nyt://article/bd51bc26-5496-5ddc-92a7-91426ae6a822,https://pogue.blogs.nytimes.com/2010/07/15/at-snopes-com-rumors-are-held-up-to-the-light/,1643,Technology,2010-07-15T18:17:44+0000,,"At Snopes.com, Rumors Are Held Up to the Light","David Pogue interviews David Mikkelson of Snopes.com, where Internet veterans go to get the truth about online rumors."
nyt://article/1850ffdb-2578-591d-9783-6acd99161fcc,https://www.nytimes.com/2010/09/14/technology/14nokia.html,508,Technology,2010-09-13T21:01:27+0000,Business,Nokia Executive to Leave; Hints of Chairman’s Exit,"The head of the company’s smartphone business will be leaving, and the world’s largest maker of mobile phones confirmed that its chairman might step down in 2012."
nyt://article/bbb2dd69-35e5-5862-80e3-ca9d8417ded0,https://www.nytimes.com/2010/07/19/business/media/19carr.html,1259,Business Day,2010-07-19T02:27:31+0000,Business,Post-Mortem: No Hair Shirt for Steve Jobs,"Steve Jobs will be giving out bumpers and cases for the iPhone 4. And in case you missed it, he doesn’t exactly have a crush on reporters."
nyt://article/1f346d70-021e-5b5b-93f2-3f5793808423,https://www.nytimes.com/2010/07/27/business/27labor.html,637,Business Day,2010-07-27T02:25:58+0000,Business,Service Unions Agree to End a Long Dispute,"The settlement, if federal regulators approve, would involve a change in ownership of a labor-owned bank."
nyt://article/8688d79d-5dad-52b2-bfd9-2ceaddd6c67f,https://www.nytimes.com/2010/08/30/world/europe/30iht-german.html,425,World,2010-08-29T21:00:00+0000,Foreign,Comments by German on Minorities Are Criticized,"Thilo Sarrazin, a board member of the German central bank, was under pressure to resign Sunday after he said ""all Jews share a particular gene. That makes them different from other peoples."""
nyt://article/78759c0e-1f82-5448-a366-4e7a1702f437,https://www.nytimes.com/2010/08/31/world/31nations.html,750,World,2010-08-30T15:33:29+0000,Foreign,Review Finds Flaws in U.N. Climate Panel Structure,"The scientists involved in crafting the panel’s climate reports need to be more open to alternative views and more transparent, an independent review said."
nyt://article/885ddb53-9fd3-53cb-a4e0-e24c382d7d66,https://www.nytimes.com/2010/08/09/world/asia/09india.html,763,World,2010-08-09T00:56:49+0000,Foreign,"India Swoons Over Its Chess Champ, and Even the Game","Viswanathan Anand, who has held the world title for three years, appears to have earned the fame that India usually reserves for movie stars, cricket players and politicians."
nyt://article/b155a479-ee4f-57df-80b9-911d5f6c20f5,https://www.nytimes.com/2010/08/07/business/energy-environment/07steel.html,671,Business Day,2010-08-07T00:56:53+0000,Business,Wind Farm Deal Assures Bigger U.S. Role,The United Steelworkers and its allies hope the agreement will ease fears that American stimulus money was subsidizing Chinese companies.
nyt://article/70828efe-bb31-57ed-abc3-760ca63f2b9b,https://www.nytimes.com/2010/07/18/business/global/18eads.html,654,Business Day,2010-07-18T03:04:59+0000,Business,EADS Looks Outside Europe to Fuel Growth,The mood among major contractors is grim amid forecasts that austerity programs across Europe will force the region’s military budgets to shrink.
nyt://article/f64e5b01-a7f1-5932-9b90-4ab6a6ad30e2,https://www.nytimes.com/2010/09/30/world/europe/30briefs-Italy.html,125,World,2010-09-30T04:16:54+0000,Foreign,Italy: Premier Survives Confidence Vote,"Prime Minister Silvio Berlusconi’s government was saved from collapse, but he could face early elections."
nyt://article/b486626f-9b52-5619-8228-4d7c1289149c,https://www.nytimes.com/2010/07/15/world/europe/15cricket.html,1118,World,2010-07-14T20:10:05+0000,Foreign,Cricket and Baseball Find Common Ground in Show,An exhibition at Lord’s cricket ground in London traces the development of cricket and baseball — and how each game has influenced the other.
nyt://article/004dd88a-ae0d-5b66-8bdf-8935231554da,https://www.nytimes.com/2010/08/15/business/15unboxed.html,1014,Business Day,2010-08-14T20:52:14+0000,SundayBusiness,"Innovate, Yes, but Make It Practical","Works in progress at Weyerhaeuser, Best Buy and Citigroup show how new products and services can address wider market needs."
nyt://article/442f7241-7724-591e-b478-4a1f54b46392,https://www.nytimes.com/2010/09/23/world/europe/23prexy.html,1163,World,2010-09-23T03:22:20+0000,Foreign,U.S. Lauds Russia on Barring Arms for Iran,Russia’s decision comes as leaders are gathered at the U.N. and America is considering reopening Iran talks.
nyt://article/67013766-c9ab-5b94-b472-55631286538d,https://www.nytimes.com/2010/07/19/business/media/19dreamworks.html,1161,Business Day,2010-07-19T02:54:47+0000,Business,"As Niche Gets Crowded, Studio Watches Its Back","As an independent, DreamWorks Animation is facing challenges on many fronts as other studios dive into animation."
nyt://article/c3cbcdc5-93db-5dea-ac65-3ff4dd1343f2,https://www.nytimes.com/2010/07/26/world/americas/26brazil.html,1184,World,2010-07-26T01:30:54+0000,Foreign,Brazil’s President Works to Lend Popularity to a Protégée,"As President Luiz Inácio Lula da Silva pushes to help his chief of staff get elected, whether he can transfer his immense popularity is unclear."
nyt://article/69fc83c1-1f54-5e7a-ac4b-1a8dbaf344eb,https://www.nytimes.com/2010/07/17/world/europe/17rocker.html,1254,World,2010-07-17T02:01:22+0000,Foreign,A Star Keeps Rocking in the Not-So-Free World,"Yuri Shevchuk, a musician, remains a voice of defiance in Russia, taking Vladimir V. Putin to task in a recent meeting. "
nyt://article/7e379a37-f4fe-5ee5-bada-71102d11fc4d,https://www.nytimes.com/2010/08/06/world/asia/06korea.html,467,World,2010-08-05T07:50:02+0000,Foreign,South Korea Begins Naval Exercises,The large-scale naval exercises took place in waters near a disputed western sea border with N. Korea.
nyt://article/211fd8ec-4b33-562d-9ab5-1b520a3ab84b,https://www.nytimes.com/2010/07/05/world/asia/05afghan.html,579,World,2010-07-04T10:42:38+0000,Foreign,Petraeus Takes Command of Afghan Mission,"Gen. David H. Petraeus took command of the troubled Afghan war in a ceremony, warning of hard days to come but promising to persevere. "
nyt://article/a89277d2-dbbc-5674-ad37-39bd33a9ef20,https://www.nytimes.com/2010/09/14/world/asia/14kashmir.html,665,World,2010-09-13T18:12:24+0000,Foreign,U.S. Koran Tensions Erupt in Kashmir,Kashmir has seen the worst violence since protests began sweeping through the disputed region three months ago.
nyt://article/d397c552-1794-5d6a-9d69-23ea44afbd88,https://www.nytimes.com/2010/09/25/world/asia/25briefs-TRAFFIC.html,138,World,2010-09-25T03:42:09+0000,Foreign,China: Weekend Traffic Expected to Be Especially Heavy in Beijing,"Chinese officials are warning that this weekend will likely be an especially bad traffic period in Beijing, as people return to work after the three-day Moon Festival holiday."
